id,title,Category
hRUBKbljc40,behind the scenes when ms dhoni told harsha bhogle that his quotanswerquot is ready ,2
MoPFkpqoAqo,virat kohli has the best technique39 rohit sharma39s rapid fire ahead of the wc ,2
9xiTjjYw5qg,the run machine virat kohli    the test  prime video india ,2
PO_rOk8TW8o,jam with fam virat kohli amp anushka sharma at puma india hq ,2
jWv7t8nDLjE,virat kohli the chasing machine indvnz  cwc23  shoaib akhtar ,2
GmFdRqJ24Yw,why virat kohli is so great ,2
RTe8LlSQcQE,the two sides of every man ft virat kohli ,2
wcf6vQQldWo,world cup               a dream comeback of virat kohli ,2
JCd7Zhcqhg8,ishowspeed reacts to virat kohli best fielding ,2
DEVU8qJmgD8,virat39s name in anushka phone  ft puma ,2
WQdqgrWvy6g,super11 asia cup 2023  super 4  pakistan vs india  full match highlights ,2
1J0o3v8ptHY,virat kohli on dressing room music dhawan39s humour his salesman skills amp dhoni i bwc s4e1  part 1 ,2
N0UR6FKRymc,virat kohli does it again  ind vs bng  world cup morning glory ,2
93XIFYJp4JA,anushka sharma takes a hilarious dig at virat kohli39s celebration his epic comeback goes viral ,2
KWGQNKQAijo,what makes kohli the best in the world  ind vs nz  cwc2023  jatin sapru ,2
smPvoNUk7j8,virat kohli shows off  ,2
YSDEKXt97cA,black and white virat kohli  sachin tendulkar      team india  cricket records ,2
3CcH4FYhjo0,it was virat kohli alyssa helay speech about virat shorts cricket ,2
TqA0tiD5z5Y,virat kohli life changing speech  speech with subtitles ,2
TunlrF6fzkc,virat kohli anthem wtc2023 ,2
NaQadfoI_-4,virat kohli called selfish cricketer after century  india beats bangladesh  umpire richard ,2
jS9MnSUzS9A,why is virat kohli the biggest brand of cricket ,2
ryuU289WZqw,quotthat guy is from a different planetquot legendary pacer wasimakram is in awe of viratkohli ,2
mVupXkSH4sQ,king kohli39s 199run series blitz  from the vault ,2
X51a0Tp-5S0,       rohit sharma  virat kohli  india vs bangladesh ,2
MjfXKL2f2Ek,wait for indian bowling  shorts cricket cricketshorts ipl ipl2023 viratkohli teamindia ,2
DiNvmYTWwDo,legendary pacer wasimakram credits viratkohli for promoting the fitness regime trend in indian ,2
L1NfeFLdwqY,virat kohli39s 122  super11 asia cup 2023  india vs pakistan ,2
4vGWxZGx6DI,was virat kohli 39selfish39  wion world of cricket ,2
ONpQVfMOvtI,virat kohli jersey no18  official trailer  ram charan  a a films  kiara advani karan j update ,2
0hfcljuFe9o,virat kohli century ind vs ban highlights king kohli    kl rahul   ,2
23Q3Rcb3h3w,virat kohli39s heart winning gesture for crying jadeja39s wife rivaba after jadeja finish in ind vs nz ,2
0oO5SM30210,virat kohli started crying after rohit sharma39s this statement viratkohli rohitsharma shorts ,2
s51o427Z0og,virat kohli century  umpire not giving wide  kohli bowling  ind vs ban 2023 ,2
CakPu2hFu6c,     virat kohli vs bangladesh malayalam cricket wc 2023 ,2
an0Q-h7SrbM,cwc 2023  kl rahul calls kohli a social media whizz ,2
kGMMqOQSXIs,virat kohli on rohit sharmai shorts viratkohli ,2
fpZXS7YpRL0,       virat kohli  sachin tendulkar  ind vs ban ,2
KjpTiKnr5Ng,virat kohli   boys memes shorts ,2
3o5GvuykJf8,msk prasad about why is kohli always anger the untold story of virat kohli  open heart with rk ,2
wbAmRKj877A,speed finds out virat kohli met ronaldo ronaldo virat speed ,2
jyyOtFrsSo0,virat kohli attitude  ,2
fPajXNnNGvY,kohli funny moments  ,2
WeQ8cfTxpuQ,virat kohli interview puma ,2
AqOuCirIiRI,sunil chettri x virat kohli   shorts cricket ,2
_nqPmmAqdSM,    18  virat kohli ,2
bkm1K_WCuIM,virat kohli first car   shorts viral viratkohli ,2
433SUexlSoc,congratulations india beat new zealand virat kohli century missing by 5 runs ,2
AeK82ODDX7o,virat kohlis transformation  how he became a cricket legend muttiah murlitharan reveals shorts ,2
SxImeQ4cPsw,128         virat kohli  olympic 2028  rj raunak ,2
d4yxcikYJ-U,chase master kohli   ind vs nz  virat kohli 95 ,2
yO6B1hFsOp4,cristiano ronaldo 2 crazy goals vs al duhail 24102023 hdi ,2
T1AGnpe_QTE,ronaldo before 2014 was unrealistic  shorts ronaldo shortsvideo ,2
Uv1PyE8J38w,i met cristiano ronaldo ,2
pTryMmINtSM,family ronaldo 2017 vs family messi 2024  ronaldo messi georginarodriguez ,2
tz8xZxd43BQ,ronaldo messi neymar and zlatan in a swimming pool  ,2
dsAHoH4cJsY,ronaldo rare moments 3 ,2
iWaw3xqPzoE,cristiano ronaldo scores 2 crazy goals in the afc champions league the goat ,2
T6qyHtvoyHY,al nassr vs al duhail extended highlights  afc champions league  cbs sports golazo  asia ,2
gJxyX0MFfrM,the greatest free kick of all time  ,2
QX4koEw0IS4,ronaldo has no reaction to ice shorts football soccer ,2
HqRHoKA6Obs,cristiano ronaldo crazy freekick goal for al nassr 21102023  hd ,2
qxEgZb1dfnU,ronaldo  highest jump in football football soccer shorts ,2
nXm_mT-Se2U,cristiano ronaldo telling about his struggling days when they couldn39t afford burgers ,2
od1GAX6x1Lg,cristiano ronaldo vs thenry  football soccer shorts ,2
COknseY-Xic,ronaldo rare moments 2 ,2
nfyHDO8EmrE,cristiano ronaldo is banned  ,2
x-C1vgVpP_o,the cristiano ronaldo jump challenge ,2
759S9__g58c,cristiano ronaldo  quotdanza kuduroquot  slowed amp reverb  skills amp goals 2023  hd ,2
3FC4YI_tryM,ronaldo va referees  football soccer shorts ,2
pdNeVkybJZQ,ronaldo messi haaland benzema kane shorts bekfootball ,2
GubWwkGo8Zk,why always me cristiano ronaldo part 1  halftimecomp  footballshorts ,2
MXvF-_JISnw,ronaldo funny moments  ,2
MTWM57qvmEM,ronaldo vs lewandowski vs ramos  pushup with kids ,2
_tZTgBEvX6E,ronaldo came back strongershorts ,2
tU16fvTaK3U,cristiano ronaldo skills level 1 to level 100 ,2
_JySkUgRWDQ,ronaldo is born differentshorts ,2
j8kpcFHY_VU,10 times ronaldo shocked the world ,2
oq61rme-hJs,respect ronaldo for his social experiment shorts football soccer ,2
5laycfjaKV4,cristiano ronaldo  overall 2023  hd ,2
hKNFmUFinv8,ronaldo is so humble  shorts ronaldo shortsvideo ,2
lCWjcLuNQqs,ronaldo showed ramos levelsshorts ,2
bHceQQw3CAM,when ronaldo was scammed by trump  football ,2
UK5cu3LJ9qk,cristiano ronaldo all ucl goals ,2
vUrqShh0BGo,gasolina  ronaldo edit   shorts edit ronaldo fyp football messi ,2
qjxX3dU9iGg,ronaldo vs messi ,2
kwq42ARcdYw,ronaldo penalty trick  ,2
Cd6lpo3yGVA,portugal before vs after cristiano ronaldo  football ronaldo shorts ,2
ADDdJb6Irao,5 times alejandro garnacho copied cristiano ronaldo  football ronaldo shorts ,2
htHGIrJe5yw,reason why barcelona fans hate cristiano ronaldo  shorts ronaldo shortsvideo ,2
c0iFV50bcWg,ronaldo vs neymar  shorts ,2
Fkr63uKdCSQ,cristiano ronaldo is cooking at 38   football products in my bio ,2
YpjwHazhknA,cristiano ronaldo vs lie detector with binance ,2
h1SX9OOtupI,julian lvarez vs cristiano ronaldo a sus 23 aos  shorts espaa cr7 argentina ,2
9DMEKpS6Gs0,cristiano ronaldo crazy goals level 1 to level 100 ,2
frKvtmFaFHA,ronaldo is on another level shorts ronaldo shortsvideo ,2
yayx_9ObwdI,he made cristiano ronaldo  ,2
y6uilnwnfVc,ronaldo team cups real madrid man united juventus al nassr   ronaldo football shorts ,2
uv1kQLw2O_8,ronaldo is a beast  shorts ronaldo shortsvideo ,2
d3hxeWFh0YA,rare ronaldo moments  shorts ,2
cLYPhZwcXD0,cristiano ronaldo free kick goal  shorts ronaldo football ,2
8VaCJmG7Y0w,messi goal  inter miami vs birmingham 20 highlights amp all goals 2023 friendly ,2
xqmtBSaJnLE,inter miami vs chicago fire 40  all goals amp highlights  2023 ,2
ZmKy_fnRM_E,lionel messi  world champion  movie ,2
K4o5BYngGSg,lionel messi could lose his world cup medal  football messi shorts ,2
wZmNlZPgeA4,messi39s world cup will be cancelled  ,2
XZDVtsCuIoA,lionel messi vs charlotte  last game 2023 ,2
XTaD4vMfMS8,lionel messi 100 magical dribbles ,2
kIdvnIecj3Y,messi is doing things he was doing 15yearsago  steve nicol  espn fc ,2
qYwlqx-JLok,messi en olga con migue granados la nota completa en miami ,2
C6sVGS5NJG8,lionel messi 2 goals vs peru wc qualifiers 2023 ,2
savnojW9Or0,lionel messi super human moments ,2
PSanJ5swYBM,lionel messi  top 20 goals of the goat  hd ,2
U4PIRn72HzY,rare messi moments ,2
7kktyWWgX5w,lionel messi showing why he won the 8th ballon d39or ,2
NhUePKELNx4,2 footballers who hate lionel messi  football messi shorts ,2
Hiyi3-B2S7o,messi moments that left the world speechless ,2
elUVFYy5ia8,messi 4 goals on fire inter miami vs chicago fire 51  messi goals  highlights amp all goals 2023 ,2
xXUwifpVnzk,lionel messi vs paraguay 2023  wc qualifiers ,2
pPNV3nX7iVs,greatest goals ever by lionel messi ,2
zJGhqyE4Ius,ligue 1 suffers due to messi and neymar leaving  football ,2
IodCaoo-Pms,10 facts that messi and ronaldo fans need ro accept ,2
x8VCZhi6hn8,lionel messi ascending to greatness ,2
QCftIjC64ac,messi 2 goal argentina vs peru 20  all goals amp highlights  2023 ,2
KzmutE3wCKU,this is why messi get so many votes in ballon d39or  fifa best player ,2
lyX0FuzzoL8,lionel messi39s impact to inter miami in truncated season  sportscenter ,2
qNtoab4SsgQ,why messi doesnt run ,2
tZ6BcR1vmKQ,is messi gay ,2
TnYATYCVsko,top 5 best messi goals ,2
ACl1GHAk4RU,messi edit  ,2
IscGtF_A14A,lionel messi  all 800 goals in career  with commentaries ,2
7nPa_Z5iyP0,messi39s vision  football soccer shorts ,2
zghRo5NMvZE,10 items messi owns that cost more than your life ,2
fqRm0TCDRw8,messi meets america  official trailer  apple tv ,2
93yttGgcCPo,messi career with argentina   shorts ,2
ZCKvoPaa9uI,rodri says messi deserves the ballon dor  football ,2
vpGwESfMggo,quotmbappe will surpass messiquot  ,2
vYXLDGy0h1Q,highlights charlotte fc vs inter miami cf  october 21 2023 ,2
v7qL-6ZrP_8,messi showed the hater levelsshorts ,2
CnTosIIHlUk,messi moments that still unbelievable ,2
YZlUBmwTwFo,messi cant be human  ,2
q7rDmR39lVc,leo messi dribbles ciro busquets39 son and jordi alba39s son for fun  ,2
D2t5j6j-Kcs,thiago messi volution 20132023  ,2
Kr1BjIrNEII,trophies that messi has not won  ,2
qUCQZyvSheE,messi and ronaldo  shorts ,2
NWcMxK3-eO8,ronaldo vs messi fans  your favourite  ,2
xlJfvdrtY9g,pep guardiola epic reaction on messi39s 8th ballon d39or win ,2
pTryMmINtSM,family ronaldo 2017 vs family messi 2024  ronaldo messi georginarodriguez ,2
Un-Njg9geVc,women39s 87 snatch  world weightlifting championships 2023 ,2
X5T02e2XBRg,quothamp the champquot   a weightlifting documentary  hampton morris ,2
MmQ9YHPQEoc,men39s 89kg snatch  world weightlifting championships 2023 ,2
gKI7hGR5z2U,weightlifting changed my life  iwf documentary ,2
itBWkXiEVdA,m81kg european weightlifting championships 2023 ,2
cmFm-_VYk4Q,strongman tries olympic lifting ft chloe brennan ,2
V2MECUlz-HE,women39s 71kg snatch  world weightlifting championships 2023 ,2
AQE7u2fYuxg, men39s 109 kg weightlifting  tokyo replays ,2
XHPhd0EPCcg,tatiana kashirina ewc 2010 weightlifting ,2
FSOLgl2z8kI,men39s 109 campj  world weightlifting championships 2023 ,2
G84YWWr9eFI,beginners guide to olympic weightlifting ,2
aLBfdPZgSII,w55kg european weightlifting championships 2023 ,2
Fcpkt96yRsM,pound for pound  strongest weightlifters in olympic history  top moments ,2
dTGiZuwtROg,women39s 71kg campj  world weightlifting championships 2023 ,2
83XGLta6Emk,master your snatch the only training session you need  polish weightlifting team  napisy ,2
dax0P4tb7d4,m109 european weightlifting championships 3923 ,2
A6E2kBuIivY,2023 iwf world weightlifting championship riyadh men 109kg groupa ,2
VS8AzfzDIig,shi zhiyong arrives at the world champs  worlds 3923  pt 1 ,2
aSXfq28aBvA,the nuance of drug use in weightlifting ,2
OkXsGWsitAc,71kg snatch battle  full backroom access 4k ,2
Qbv2edgrgvI,weight training for beginners amp seniors  20 minute workout to build strength ,2
NsBesN5B_ik,m89 asian weightlifting championships 2023 ,2
qv_KJGTvmg8,why weight lifting is a waste of time  dr john jaquish  tedxmayfieldhs ,2
ZzkHA7iMosM,bulgarian weightlifters unleash in the training hall  worlds 2023 4k ,2
eHyAPaTq2Fs,max out friday at usa weightlifting nationals ,2
77Gk7QnK0Iw,2023 iwf world weightlifting championship riyadh 89kg men groupa ,2
6V2JSPtYewM,m81kg snatch  world weightlifting championships 2023 ,2
i6UzIWxKrW0,american weightlifting the documentary 2013 ,2
dADsn7sSW0s,men39s 89kg campj  world weightlifting championships 2023 ,2
PFlDdX6fKVQ,the casuals guide to olympic weightlifting ,2
FNRAHcIJbfI,m81kg campj  world weightlifting championships 2023 ,2
6CIWvwYUWfQ,the perfect workout for olympic weightlifting ,2
iLel29pZ314,the strongest snatch battle ever  220kg snatches ,2
i7BKJhNSDXM,american weightlifting ,2
B4-eGEDLhzQ,w49kg european weightlifting championships 2023 ,2
fqRuf5ehiOA,why you should train like a hybrid athlete running  weight lifting ,2
MlnCVwi8WIM,how this guy became the best clean amp jerker on earth ,2
uAv87PsTgWw,this changes weightlifting technique forever ,2
Ew8JOAARKbI,men39s 67kg campj  world weightlifting championships 2023 ,2
Gtw_NAppoBY,men 109kg world weightlifting championships 2023 weightlifting worldweightlifting ,2
md0_8YmGBss,m89kg european weightlifting championships 2023 ,2
iDCYYJC12GY,big mistake with weightlifting belts ,2
wHvF0SFDis0,w81kg snatch  world weightlifting championships 2023 ,2
lhSAy-GIUMg,deadlift competition 310 kg  ,2
IO5RZfb8vYc,men39s 102kg campj  world weightlifting championships 2023 ,2
32R5bQ3X2mw,men 96kg a world weightlifting championships 2023 weightlifting worldweightlifting ,2
r6ayw3d6DK0,how mr toomuchmuscle trains ,2
7RcRZZrL13k,the best olympic weightlifting program ft zack telander ,2
R8j0E8SC6oo,china39s next top weightlifter ,2
VD9p9tEP9RE,how much muscle can you build with amp without steroids ,2
TuRv8gRfvb8,how to lose fat and gain muscle at the same time step by step ,2
kmuMyXgTEWg,the reason cbum wants to quit bodybuilding  ,2
lu_BObG6dj8,how to build muscle explained in 5 levels ,2
X27F4kgBJKk,how i built muscle fast 5 sciencebased tips ,2
ehMHnR7yMhw,most honest advice for building muscle as a natural ,2
dF-py7pQJMI,bodybuilding side effects  shortsvideos gym ,2
LyzN5PyPpdc,bodybuilding  benefits  shortsyoutube ,2
nuzT2iJESFA,complete muscle guide for bodybuilders ,2
yliHX5u3HZY,building muscle after 50  the definitive guide ,2
R-eLKV7aFeY,endure the pain  ready for battle  epic bodybuilding motivation ,2
MmyuGVeFUTs,andrew tate39s bodybuilding routine  ,2
hggkrZF-Bpw,10 essential bodybuilding tips  dorian yates39 blood amp guts ,2
s1U7E2dIDac,diet for muscle amp staying lean  my meal plan ,2
LhEFM7qerCI,15 idiotic muscle building mistakes avoid these ,2
qGeDXYf0tsU,old school bodybuilding diet and workout motivation  cant train like a horse and eat like a bird ,2
TbY_5mOBZlU,top trainers agree these are the 10 best musclebuilding exercises ,2
dNkFaWCXYMs,how to break a muscle building plateau ,2
NIjTdbb32P0, nightfall side effects on muscle building and body shorts ,2
xW79HPiyidk,how to build muscle almost 2x faster new research ,2
SgvCMxYPOFs,bodybuilding motivation  i am the beast musclefactory ,2
pNOb7jockSg,the most important muscle building stimulus 87 studies ,2
v7tZ1sDOKqc,the only one who can beat me is me  the king of classic  cbum motivation ,2
ywwDpAunteo,bodybuilding poses for aesthetics ,2
XLeqsNKyYbI,5 best tips for muscle building skinny people    5    ,2
rsse-MxtnpY,why you should pose more arnoldschwarzenegger gymmotivation bodybuilding ,2
alR12hSp8yA,derek lunsford is next mr olympia  only top 3 qualifies automatically  hadi choopan looks crazy ,2
gyd0V5vTnw4,94  why i quit bodybuilding  cutler cast ,2
kHuNGj3f4LE,the only 8 bodyweight exercises you need to build muscle fast ,2
k7JU1V5pBWs,bodybuilding is the foundation  money mind muscle  success motivation ,2
0M5KV9B6Q0s,top 5 supplements i use for natural bodybuilding  shorts youtubeshorts ,2
YzAiUcybI9U,wtf happened to bodybuilding ,2
M4K0s792wAU,how to build muscle and lose fat at the same time step by step explained body recomposition ,2
yeXYwHgDUl8,entire gym stares at sam sulek shorts samsulek bodybuilding samsulek ,2
XrrhvtEmsfI,the goats of each era in bodybuilding  shorts bodybuilding gym fitness motivation mrolympia ,2
GViX8riaHX4,30 min full body dumbbell workout at home  muscle building ,2
8S-mxrO0bzk,build muscle at home with no equipment part 2 ,2
47Dt93KB3T4,how to start building muscle for beginners ,2
Icw8KLcpE_Q,phases of a gymbros outfits bodybuilding fitness gym shorts ,2
VPI1wzHn2no,kill all excuses  time to work hard  epic bodybuilding motivation ,2
7wLlR9PmuaI,7 things no one tells you about building muscle after 40 ,2
5qI6U8KMt84,high intensity works  do what needs to be done  bodybuilding motivation  ,2
SjSJU-LOLf8,iron series 30 min muscle building full body workout  19 ,2
pT1v8Qw5iEI,5 exercises that will help you gain muscle mass at home  shorts ,2
1_l1TRem6WA,full day of eating  i ate 8 times a day  bodybuilding diet motivation ,2
bq-CYdjX5_A,don39t overcomplicate bodybuilding  it39s simple to get jacked ,2
Pyo1AUo1Ysk,full day of eating during a lean bulk  joshua manoi  3732 calories ,2
SUq6-D_TBVQ,7 min 7 exercises to build big arms no equipment ,2
Ss560yz9VY4,one hour nonstop bodybuilding motivation ,2
uudJFzMGdjY,27x30 junk food challenge  bicepworkout bodybuildingnation bodybuilding fitness ,2
3dLDPhdLDdk,calisthenics for beginners 2023 ,2
EUe8WnbrSnQ,easy calisthenics skills that look hard ,2
gOkCJ57IvNg,home workout for beginners 2023 ,2
qdR0lwDx9hY,how to start calisthenics the ultimate beginners guide ,2
vczr0WuYK9g,calisthenics for beginners  in depth stepbystep guide to building strength and muscle ,2
hEXjX6nwDoY,how to start calisthenics at home for beginners no equipment ,2
RoxKbyst0To,10 best exercises to start calisthenics   beginner workout routine ,2
i8fsLltfJfk,master calisthenics with 6 moves ,2
UrkI3_W7Imc,how i got shredded with calisthenics ,2
9RrPEBdTKA0,my beginner calisthenics routine  8 years later ,2
UdJgGC30gLk,my body after 30 days of calisthenics ,2
1mlN0yuxoLE,calisthenics for complete beginners tips exercise form programming ,2
3XeRnfZennY,3 best calisthenics skills to learn  beginners ,2
6Wayt79EHNs,10 best calisthenics exercises ,2
8gQbgyTlS-8,how to start calisthenics at home for beginners no equipment ,2
xWwRpX3cfX0,how to program your calisthenics training for the fastest growth ,2
2AgCdKa8Rus,how to start calisthenics to gain insane strength and aesthetics a beginner39s guide ,2
8-49TscRd0M,5 things i wish i knew when i started calisthenics ,2
VLOKMjHEyhY,calisthenics explained  are bodyweight exercises good for building muscle ,2
8fKAvpVFmqU,bulking with calisthenics ,2
TOXmdZ35CH0,beginner at home calisthenics workout  no equipment 20 minutes full body ,2
9K9lTOQ8uEM,10 calisthenics exercises that build the most muscle ,2
AtZRlH5rtr8,powerlifters try to complete the most difficult calisthenics exercises ,2
8ez_T3kxUmc,why calisthenics never worked for you the harsh truth ,2
w4EaDUZ_zXA,why most people quit doing calisthenics ,2
YopfbigAzq4,calisthenics solos ,2
7PfE9X-TFsY,15 min calisthenics workout  no equipment  all levels ,2
6matQFr2W0s,ranking calisthenics exercises beginner to god ,2
h2vAozPxvzU,i only trained weighted calisthenics for 30 days ,2
MIy0XeKFuZM,calisthenic ,2
h_h1c7IYArs,start calisthenics at home  ,2
NUmfIeYZDX4,6 years of calisthenics crazy strength ,2
13fACN1H3WY,calisthenics in public challenge gone wrong  ,2
5p5DgAigceU,bodybuilder vs calisthenics strength battle ft browney ,2
RAUKlDiOEL8,top 5 mustmaster calisthenics skills for beginners ,2
HziEFzDV4vY,bro39s training to defeat the gods   ,2
SaKruW6L62Q,why arent more people good at calisthenics ,2
6P_dYlCLM-8,i will transform him from skinny to strong  beginner calisthenics to build muscle ,2
QkQVIYA4roE,anime exercises ranked in real life easy to impossible ,2
du2MTkUJAOQ,why bodybuilders are terrible at calisthenics ,2
GSwegO3P-d4,my 5 year calisthenics transformation  beginner female calisthenics motivation  ,2
3Jo3ocRRil4,marine athlete vs calisthenic athlete brolygainz007 ,2
mc8BT7agJ18,the harsh truth about calisthenics ,2
99oSteSUCfo,calisthenics reactions ,2
7Ys-uQjT2e0,he built muscular back abs  ,2
MHMH4RXuxfY,steps to handstand pushup  calisthenics handstandpushup ,2
OsQSqTdIZRo,people are watching what i do shoulderflaf calisthenics in public reactioncalisthenics shorts ,2
WhLialqwJDM,skills that are easier than they look calisthenics ,2
04kAfDdqEfg,the perfect workout routine for teens sciencebased ,2
cbKkB3POqaY,25 min full body hiit for beginners  no equipment  no repeat home workout ,2
bqt7qh5oq38,how to build your weekly workout program  jeff cavaliere amp dr andrew huberman ,2
GPbuWUktZc4,my workout schedule  ,2
eTxO5ZMxcsc,full body 5x per week why high frequency training is so effective ,2
sWUgK8FrEHg,6 simple exercises to lose weight at home  no equipment needed ,2
RDWyqnGhmWY,the best workout split for maximum muscle gains ,2
5YsueoP3kM0,10 best exercises to start calisthenics  workout plan ,2
gC3EvXtgxGI,home workout plan for weight loss and toning ,2
eMjyvIQbn9M,the best sciencebased minimalist workout plan under 45 mins ,2
9O8mOtdKr44,the best sciencebased workout split to maximize growth choose wisely ,2
IT94xC35u6k,20 min fat burning workout for total beginners achievable no equipment ,2
KmXeavpGQT0,the best muscle building workout plan for you maximum gains ,2
LhL5SNZfnQs,14 days weight loss challenge  home workout routine ,2
8uUawnM-FD8,kids exercise  kids workout at home ,2
bTo4NrSriWw,20 min full body workout intense routine no equipment ,2
YjLni7LsycM,full body workout without equipment ,2
y6SeNMF1Pp0,the 5 most important exercises for runners ,2
GViX8riaHX4,30 min full body dumbbell workout at home  muscle building ,2
qXXVQkpfasQ,how to build your best workout week  3 day 4 day 5 day split ,2
CKw1nmZkNEs,workout plan with the best results bernardorebeil workoutplan workout workoutroutine ,2
Hxwd-9p54c8,how to start working out lifechanging tips to be consistent advice for motivation amp gym anxiety ,2
Tl3ue_d4Y6g,beginner workout routine for students ,2
Qi0p-6XcTX0,workout program for skinny guys trying to get bigger ,2
iCQ2gC4DqJw,perfect 20 min full body workout for beginners no equipment ,2
PG2f3GF5RlI,top 10 morning exercises to do at home ,2
GPq1_yGsa04,the best workout routine for beginners ,2
wISZHfVB-dU,andrew huberman39s weekly workouts for muscle growth and strength ,2
6NQhGbsALxA,best exercises for men over 50 ,2
V7cdJ9-T6CM,8 best exercises to shrink stomach fat fast ,2
bVrj4pIPEqg,why you should do full body training spits instead of pushpull ,2
ZuZRK_Am2ig,jocko39s workout routine  jocko willink amp dr andrew huberman ,2
CIxNJbit9BA,half an hour weight loss  30 min home workout to burn fat ,2
BmvZiGMhYXw,full body vs split training which is best ,2
YGGleRBn99Q,the only 7 exercises men need to build muscle ,2
Wa4f7f5y7uQ,how to create the perfect workout plan  beginner guide ,2
TtnpyBcxHSQ,burn fat  best 30 min home workout routine ,2
QDhMbbx0a2Y,make your own workout routine  ,2
3PMrt-1WDaI,the best workout routine for beginners  build muscle amp lose fat ,2
xc4OtzAnVMI,how to train like a minimalist more gains in less time ,2
DeH1RyLhMjo,5 exercises you need to build muscle ,2
PKjJ7lTXLJY,dumbbell upperbody workout no bench 1 ,2
iMqk4weSqh8,realistic week of workouts that helped me tone up as a beginner amp post workout meal ideas ,2
lz4i2CSD2Pg,3 signs your workout plan isn39t working beginner39s guide ,2
ixkQaZXVQjs,the perfect beginner workout sets and reps included ,2
5u4tpODih2s,build muscle lose fat  what you need to know   diet cardio tips  full week of workouts ,2
agvdkRc_img,do this workout every evening  10 minute full body to get in shape ,2
TSIbzfcnv_8,the perfect mobility routine to get your sht together based on your body ,2
dRGQDubSAqw,artistic swimming  full team event from rio 2016  throwback thursday ,2
zbBmQhoenf8,simone biles crushes field for historic sixth world title tying the most ever  nbc sports ,2
UmIYanq5gH8,michael phelps last olympic race  swimming men39s 4x100m medley relay final  rio 2016 replay ,2
J_z-W4UVHkw,every country on earth fights for 250000 ,2
zMFb8Y2QLPc,men39s 100m final   tokyo replays ,2
tPvGhbl3EJs,men39s diving 10m platform  final  tokyo 2020 ,2
n6KFOcBPZiI, live powerlifting world classic open championships  men39s 93kg amp women39s 76kg group a ,2
VOAlVzURo1A,worst olympics record  ,2
FuiJHJz4f5Q,usain bolt  all olympic finals  bonus round  top moments ,2
p69LfoWG5eM,simone biles is back the goat dominates us classic in first meet in two years  nbc sports ,2
l9wUr-CK1Y4,basketball  usa vs spain  men39s gold final  london 2012 olympic games ,2
azJGBCHz34Q,iconic paris sites get ready to take center stage for 2024 olympics ,2
AQE7u2fYuxg, men39s 109 kg weightlifting  tokyo replays ,2
vQopnwLFdXc,the highest scores in olympic gymnastics history biles maroney liukin and more  nbc sports ,2
xm88vCKbP5Y,women39s individual all around final  artistic gymnastics  rio 2016 replays ,2
tJ4FiSpvEXo,women39s 3m springboard diving semifinals at tokyo 2020 ,2
LtpHjHMNZz0, rocket league  live olympic esport exhibition ,2
7dzUAi8QWVI,the night suni lee became a legend and claimed allaround gold  full broadcast  nbc sports ,2
TH8HKvMIuGM, live powerlifting world classic open championships  men39s 105kg amp 120kg group a ,2
aTNfUNNNRC0, live street skateboarding semifinals  wst lausanne 2023  roadtoparis2024 ,2
3aWKlCTBO38, live powerlifting world classic open championships  men39s 66kg amp women39s 57kg group a ,2
ZEm_lLln-XE,the olympic favorite curse ,2
Uyuw1tX0gK8,men39s pole vault final  tokyo replays ,2
zELSszD7WYY, live street skateboarding finals  wst lausanne 2023  roadtoparis2024 ,2
7gNoLnGpdz0, live powerlifting world classic open championships  women39s 84kg ,2
9QHRGtWuwkU,paris olympics 2024 10 things you need to know ,2
8iemvVujQxA, live powerlifting world classic open championships  men39s 83kg amp women39s 69kg group a ,2
PASWhLS2haE, live street skateboarding finals  wst rome 2023  roadtoparis2024 ,2
BWoTdXxGqyI, live powerlifting world classic open championships  men39s 74kg amp women39s 63kg group a ,2
