id,title,Category
X7mxgfcM1jY,free travis scott x metro boomin type beat  quotfreakyquot  trap instrumental 2023  prod krixus ,1
7aUZtDaxS60,metro boomin aap rocky roisee  am i dreaming visualizer ,1
eZZR2YQoVyg,metro boomin  heroes amp villains album mix prod by sbdagain ,1
_AcodjYU8iw,metro boomin john legend  on time visualizer ,1
6DWjiWEmxME,creepin39 remix official video ,1
y0fNufIC36o,metro boomin  amazon music live 2023 full set ,1
qTci2WoA81k,when you lie to metro boomin shorts metroboomin ,1
qBWhc4qbsjo,metro boomin  space cadet official music video ft gunna ,1
Z8vDU6vUTj4,metro boomin travis scott 21 savage  niagara falls foot or 2 visualizer ,1
IjnCoWA9u9M,metro boomin  around me visualizer ft don toliver ,1
8fK1kA9Q-3Y,metro boomin  space cadet feat gunna official audio ,1
g7tQWyGR4DQ,how too many nights was recorded  zysquad metroboomin ,1
o3FNw1NyUCg,metro boomin nav a boogie wit da hoodie swae lee  calling official video ,1
LPTlvQ1Zet0,21 savage offset metro boomin  ric flair drip official music video ,1
u919Qe1bVf4,where metro boomin got his other iconic producer tag  ,1
acYUqMd9k2I,21 savage amp metro boomin  glock in my lap official music video ,1
2WqI50mc7Jo,metro boomin travis scott  raindrops insane visualizer ,1
QkaWdvv-jKg,metro boomin future chris brown  superhero heroes amp villains visualizer ,1
H4MQkJMxyy0,metro boomin ft future swae lee a boogie wit da hoodie amp nav  quotsuperheroquotquotcallingquot  2023 vmas ,1
T1yDdUs0uLg,too many nights ,1
uWdHM3-2cpU,trance ,1
Ox6lgb5-ikk,metro boomin  heroes amp villains transition  ,1
S5qPYsSfMWg,metro boomin  calling lyrics ft swae lee nav amp a boogie wit da hoodie ,1
f8uIgm6q87Q,metro boomin on producing hits working with future migos post malone amp more  billboard cover ,1
OwbI9IY9Roo,offset amp metro boomin   quotric flair dripquot official audio ,1
sn-Z5O9r22A,where metro boomin got his iconic producer tag  ,1
MjkbRx2qdI4,metro boomin  too many nights lyrics ft don toliver future ,1
iWDxMpLvaUE,metro boomin nav a boogie wit da hoodie swae lee  calling ,1
ZZ6VhTBcc-c,21 savage x metro boomin  runnin official music video ,1
6wtwpUwxQik,21 savage amp metro boomin  no heart official music video ,1
WSHhp-VXTZs,metro boomin  quotno complaintsquot feat offset amp drake official audio ,1
lFN9jDziQ78,metro boomin 21 savage young nudy  umbrella visualizer ,1
E0MGTZJONbo,good cookup vol 3 ft aap rocky feel the fiyaaaah ,1
AwZGG1nGsdo,how trance was recorded  zysquad metroboomin trance ,1
ywjkG9uwCQg,metro boomin song challenge how many do you know  ,1
48LvZVrlY9A,metro boomin  10 freaky girls with 21 savage official audio ,1
eeMHqN4Phjk,metro boomin  no more feat travis scott kodak black amp 21 svage ,1
LOqGYF0oFIg,creepin39 ,1
wmYsGNr-Gv8,too many nightsniagara falls seamless transition  metro boomin x travis scott x don toliver ,1
DwuJeGYlYyw,lauv  steal the show from quotelementalquot ,1
RlPNh_PBZb4,olivia rodrigo  vampire official video ,1
hggjZ-FGGkw,post malone  overdrive official live performance  vevo ,1
VuNIsY6JdUw,taylor swift  you belong with me ,1
uh4dTLJ9q9o,disney music  lava official lyric video from quotlavaquot ,1
pZjkFbK4e98,fridayy  done for me live session  vevo ctrl ,1
k0BWlvnBmIE,katy perry  wide awake official video ,1
VronettmNRI,ariana grande  positions album official live performances  vevo ,1
YLIoaXDHf6I,2pac  afraid 2 die 2023 ,1
E5ONTXHS2mM,desiigner  panda official music video ,1
7dp4GLm7sgo,lady antebellum  need you now live ,1
x7q4BfuYtEg,katy perry bon appetit ft migos  vevo songs vevo ,1
fRh_vgS2dFE,justin bieber  sorry purpose  the movement ,1
qBB_QOZNEdc,hailee steinfeld  most girls official video ,1
kJQP7kiw5Fk,luis fonsi  despacito ft daddy yankee ,1
4Y7pRYhvOBU,lia marie johnson  dna official video ,1
VzEqqSUWNjw,post malone  austin official live performances  vevo ,1
dPI-mRFEIH0,katy perry  bon apptit official ft migos ,1
uL52DajINdY,ariana grande  positions official live performance  vevo ,1
mH_xOpihKhI,eric nam  only for a moment live performance  vevo ,1
8xH0sdjMINY,the weeknd  faith official live performance  vevo ,1
YQHsXMglC9A,adele  hello official music video ,1
yxWldCmiGaI,holly humberstone  ghost me live  vevo studio performance ,1
FPk_T3b3kM8,la alegria remix  vevo  deadpool car fight scene ,1
NQ1eqKQJwtw,justin bieber  lonely official live performance  vevo ,1
bagAoB4o6Os,speakerman theme song  everybody wants to rule the world  tears for fears ft dafuqboom  ,1
gxYOr_a8BC0,kalado  make me feel the shape of you fabi benz remix ,1
_ZZoaO6YXFk,coco jones  icu live performance  vevo ,1
oYUdBUPAqhU,top 40 songs this week 2023  playlist music hits 2023 ,1
UcAU-5jCR8g,kalado  sexcited ,1
E51I8c-7Kc0,doja cat  the making of 39paint the town red39 vevo footnotes ,1
9mIedwAiQgk,thomas newman  stop wade from quotelementalquot ,1
a0AUULJgen8,leo dan en vivo by vevo ,1
nfWlot6h_JM,taylor swift  shake it off ,1
i7mzk_mE0oA,qu es vevo  shorts ,1
OT7EpBpxpG8,maisie peters  therapy live performance  vevo ,1
txXC4uBqFws,jahvillani  abundance official music video ,1
O_YUu6iM-aI,jos mara napolen  hombre ft jos mara ,1
S3HGHuGZqm0,tommy lee sparta  feeling lonely official music video ,1
e-ORhEE9VVg,taylor swift  blank space ,1
uOK-063b640,squash  freeze cold  official music video ,1
lWA2pjMjpBs,rihanna  diamonds ,1
3ZcgUPwyhuI,romeo santos  bebo official video ,1
uxpDa-c-4Mc,drake  hotline bling ,1
nph0Pt91dEE,cardenales de nuevo len  mi cmplice video oficial ,1
kffacxfA7G4,justin bieber  baby ft ludacris ,1
i7YvaaAkRCw,billie eilish  male fantasy official live performance  vevo ,1
fLFvbwrWLQY,ariana grande  pov official live performance  vevo ,1
Z4N8lzKNfy4,lil durk  all my life ft j cole official video ,1
YOyE3IfEj8w,lil mabu  mathematical disrespect live mic performance ,1
XbGs_qK2PQA,eminem  rap god explicit ,1
28hYUZMufDg,dababy  bop on broadway hip hop musical ,1
XTwkTVjbn78,don39t mess with me while i39m jellyfishing  spongebob rap freestyle ,1
no67aDqzT6Q,hip hop mix  snoop dogg ice cube pop smoke 2pac 5o cent dmx eazy e biggie dr dre nwa ,1
FmLzfYBHfuY,if asian parents made a rap song ,1
rwYrEEka1mc,9039s hip hop mix 01 best of old school rap songs  throwback rap classics  westcoast  eastcoast ,1
BC5eQTyJipQ,emiway  still number 1  lyrics   diedbad music  ,1
w2IhccXakkE,polo g  rapstar official video ,1
gsqgBT6tLsw,top 100 most streamed rap songs of all time spotify 2023 updated ,1
TdQK04DA8lw,worst rap songs to ever exits  rap lilpump shorts ,1
ItgqSPQYCbY,90s rap music hits playlist  old school hip hop mix  classic hip hop playlist mix ,1
w9yqND1XFIA,these songs are fire  ,1
gPgoQ2FwUz4,eminem best rap music playlist 2024 eminem greatest hits full album 2024  please subscribe our chnl ,1
m9k7SJmPAAQ,9039s hip hop mix 06  best of old school rap songs  throwback rap classics  westcoast  eastcoast ,1
vd2Zzo-8AJY,gojo rap  hold up  daddyphatsnaps ft oricadia jujutsu kaisen ,1
_2sGsqzFXks,good vibes only  hiphop  chillhop  lofi radio 247 ,1
tvmUrOSahsc,that mexican ot  johnny dang feat paul wall amp drodi official music video ,1
BJzmJxLncO4,9039s hip hop mix 02 best of old school rap songs  throwback rap classics  westcoast eastcoast ,1
n0bu3rNy-2k,from 2020 to 2023 the best rap songs of this decade ,1
jfKfPfyJRdk,lofi hip hop radio   beats to relaxstudy to ,1
1bI-M5I3JZk,best rap songs 2022  best of 2022 hip hop mix  trap tape new year 2023 mix  dj noize ,1
ATBuEL-L5fU,lilbaby  best songs collection 2021  greatest hits  best music playlist  rap hip hop 2021 ,1
5yx6BWlEVcY,chillhop radio  jazzy amp lofi hip hop beats  ,1
n7rE-Wlo5wg,rundown spaz  first day out freestyle official music video ,1
7NOSDKb0HlU,lofi hip hop radio  beats to studyrelax to  ,1
3LVPxV6eW_0,he shocked the rest of the rappers with this freestylefreestyle rap music newrap sub fyp ,1
lP26UCnoH9s,coffee shop radio   247 lofi amp jazzy hiphop beats ,1
l21wGxlWwPw,gunna  fukumean official visualizer ,1
4tywp83zkmk,shubh  cheques official music video ,1
AX6OrbgS8lI,aur  tu hai kahan  raffey  usama  ahad official music video ,1
rUxyKA_-grg,lofi hip hop radio   beats to sleepchill to ,1
05689ErDUdM,rap live radio 247  hiphop popular rap music amp uproxx sessions live performances ,1
2u80yFDtszE,street celebrity  kayden sharma  mtv hustle 03 represent ,1
mqYQWmQuD4E,the doritos rap song themanniishowcomseries ,1
uNd5kvrGHjk,hits radio 1 top hits 2023 new popular songs 2023  pop music 2023 best english songs 2023 new music ,1
kAe_o_S3V18,the no1 rap song from each year 20132023 ,1
fWl1YtV6q7Y,chore baithe ncr official video  dev wrld  bad junkie  rap songs  new haryanvi song 2023 ,1
Q0jse0VxRI0,doja cat pop songs vs rap songs shorts dojacat pop popmusic rap nowplaying ,1
UhbixyxgsiU,lil uzi vert  just wanna rock official music video ,1
bMe28utWdbE,maa rap     maa rap song  official video  rapper sohan official ,1
R_ruyg2vp7g,top 10 spotify kalye hip hop ,1
VcNb7xHwxCc,the most streamed rap songs of all time ,1
GbXtCRCT0Ig,mc stan  basti ka hasti official video  insaan  2023 ,1
qFHQrAx2FaE,old school hip hop mix  snoop dogg dr dre eminem the game 50 cent  best rap songs ever ,1
yZ0uETkXkSk,jaxk  nambo prod memax  official music video  bantai records ,1
g3pLoVClX9M,kaliii  area codes official music video ,1
2KIIv4JzSto,top 10 best rap songs of all time ranked by fans shorts ,1
HAZoLuME-PU,jazzlofi hip hop radiochill beats to relaxstudy to live 247 ,1
mzB1VGEGcSU,juice wrld  lucid dreams directed by cole bennett ,1
JdXubSf5YUc,juice wrld amp cordae  doomsday directed by cole bennett ,1
EYygYkYldHw,juice wrld  glod up official music video ,1
GJspBjve7rg,lil tecca and juice wrld perform ransom  ,1
C5i-UnuUKUI,juice wrld  wishing well official music video ,1
ZYZw8ifArVs,juice wrld all girls are the same live  ,1
5SejM_hBvMM,juice wrld   lean wit me official music video ,1
iI34LYmJ1Fs,juice wrld  robbery directed by cole bennett ,1
EXiNN7pBOpE,juice wrlddo her worse unreleased prodcj amv ,1
RIDiPTX0eTk,juice wrld  loser unreleased prodrockyroadz ,1
h3EJICKwITw,juice wrld  all girls are the same directed by cole bennett ,1
BxG9wx7m2Zw,are these artist better at rapping or singing  juicewrld takes torylanez travisscott rapquiz ,1
2Qb7j4OV9MM,stop me when i say a good song  eminem juicewrld stop rapquiz travisscott nav musictaste ,1
ZengOKCUBHo,juice wrld  righteous official video ,1
HA1srD2DwaI,juice wrld  burn official music video ,1
0_7XPkBAxpo,juice wrld  cheese and dope freestyle ,1
0SDaT7PAwgs,juice wrld freestyles xxxtentacion  sad  ,1
Sw5fNI400E4,juice wrld  bandit ft nba youngboy directed by cole bennett ,1
cr82wSBZeeQ,juice wrld  armed amp dangerous directed by cole bennett ,1
RRl_C73vFtQ,juice wrld  black amp white ,1
OcQ71ubUXAE,juice wrld  conversations official music video ,1
Sis_JJZoAfQ,juice wrld  cigarettes official visualizer ,1
Q-VfUkq2zL8,juice wrld  these days 999 juicewrld nogood thesedays ,1
5IUxO8tWpD0,juice wrld  tsunami ft xxxtentacion music video best quality ,1
8FCaPKoHR3k,juice wrld  cigarettes official music video ,1
zoGKwkdUspY,juice wrld  dark inside music video ,1
9LSyWM2CL-U,juice wrld  empty official audio ,1
pdznRziAJDQ,juice wrld  lobster pizza new leak ,1
f74GYIVMk3I,juice wrld  already dead official music video ,1
DANPnoPpvPI,bro was flabbergasted presave scooby on my ig  jvdenmills kaicenat juicewrld xxxtentacion ,1
lzQpS1rH3zI,juice wrld  fast ,1
xTQfRFfV_8g,juice wrld  she39s not there music video ,1
EAfckg0ORS4,juice wrld  already dead official audio ,1
HKxiWRscDjE,chill vibe juice wrld songs playlist ,1
Z9yaG27quz0,juice wrld  stay high official audio ,1
dIzgiclddlM,juice wrld  quotlegendsquot official audio ,1
sKeiomiXGio,how juice wrld recorded bandit in studio ,1
RG9xHEF1vyk,juice wrld  flaws and sins official audio ,1
swDam6Hrsm8,juice wrld quotlet me know i wonder why freestylequot official audio ,1
ghzdwjWrWcc,juice wrld  bad boy ft young thug directed by cole bennett ,1
2avPJ9TZNmU,juice wrld amp the weeknd  smile official video ,1
1VSZtyenNlA,juice wrld  conversations official audio ,1
euSAgaub3m8,juice wrld  hear me calling ,1
Udi_PfMEtPQ,juice wrld  get excited cdq remaster updated w new snippets ,1
ym9MpAz5PNI,juice wrld  sometimes official visualizer ,1
b0ofLjEzC24,lilpeep xxxtentacion juicewrld popsmoke lilloaded legend never die  legendneverdie  ,1
DqZhP-Vuxgs,juice wrld  in my head ,1
3Klj_pjjqUM,juice wrld  blood on my jeans official audio ,1
tUHuaSWTbfU,juice wrld39s freestyle for xxxtentacion  rip ,1
lcw5mfJRU7I,juice wrld  been hurting music video ,1
OduuPhI9keo,80s amp 90s hard rock  acdc nirvana bon jovi gnr ccr u2 scorpions aerosmith metallica ,1
2hMCQw3tsMA,queen u2 guns39 n roses aerosmith scorpions  classic rock songs 70s 80s 90s full album ,1
ON5ghWEPN50,top 100 best classic rock songs of all time  guns n roses bon jovi led zeppelin metallica queen ,1
PpeEa8io00U,classic rock songs 70s 80s 90s full album  queen eagles pink floyd def leppard bon jovi ,1
cOjYAFS24gc,alternative rock of the 90s 2000s  linkin park creed audioslave hinder evanescence ,1
b_PmEGMvrJM,queen u2 guns39 n roses aerosmith scorpions  classic rock songs 70s 80s 90s full album ,1
x9OaVTW0Ih8,best classic rock songs of all time  aerosmith u2 the beatles acdc metallica bon jovi ,1
PAgj1D0PfBc,classic rock songs 70s 80s 90s full album  queenbon jovieagles pink floyd def leppard ,1
imAp02nQP2g,classic rock songs 70s 80s 90s full album  queen eagles pink floyd def leppard bon jovi ,1
dF9JXK34m3M,classic rock songs 70s 80s 90s full album  queen eagles pink floyd def leppard bon jovi ,1
bAgvriO5L-A,alternative rock of the 2000s  linkin park creed audioslave hinder evanescence ,1
CjOVvYO032Q,gnr aerosmith scorpions bon jovi eagles foreigner  nonstop slow rock ballads 70s 80s 90s ,1
rXxFa8kU9bI,creed nirvana coldplay linkin park 3 door down metallica  alternative rock of 9039s amp 200039s ,1
mwKHEvkdjl0,pov coming out as emo to your parents  emo gothic alternative rock rockmusic hardrock ,1
tfsTIEfn0IU,linkin park coldplay creed evanescence nickelback foo fighters  alternative rock 90s hits ,1
S8piCHN602g,justin bieber  body rock beauty and a beat lyrics ft nicki minaj ,1
EHNACqq1tmc,classic rock 70s 80s 90s full album  metallica aerosmith acdc nirvana queen bon jovi u2 gnr ,1
4BSQWr6G8VU,eric clapton lionel richie bee gees rod stewart elton john  soft rock best songs of all time ,1
PXoEAX_3VIU,rock 2023 mix rock alternative  gaming music  ,1
TlLpWj1mZ78,reggae mix 2023  oldies but goodies reggae songs  all time favorite reggae songs 2023 ,1
pif9XowMAzw,rock 2023 mix light rock alternative  gaming music  ,1
0PkKXkEIMdc,top 100 most viewed rock songs on youtube ,1
dTc1pyv2YSQ,nonstop soft rock medley  best of oldies but goodies   lobo bee gees phil collins lionel richie ,1
AGrJE6EF7a4,edit audio but all songs in rock version ,1
9-BMwKU-ixE,nirvana scorpion bon jovi aerosmith foreigner the eagles  slow rock love songs nonstop 80s 90s ,1
SvvkvWYpCu8,nirvana scorpions aerosmith white lion bon jovi gnr  best slow rock songs of the 70s 80s 90s ,1
vscSFhepBVo,sfm skibidi toilet animated song ,1
tWTPGVIw1es,247 alternative  rock radio  ,1
AOq-UiY6yGg,top 100 most recognizable rock songs of alltime ,1
M-A3fkTuLio,relaxing whiskey blues music  best of slow blues rock ballads  fantastic electric guitar blues ,1
j0O6vzxmEP8,nirvana aerosmith scorpions bon jovi gnr bread eric clapton  slow rock ballads 80s 90s hits ,1
IxVytU0XV8s,classic rock songs  video mix ,1
ial7u1aXud4,disco dance nonstop greatest hits 80s modern talking and more hd ,1
aSkFygPCTwE,kid rock  all summer long official music video ,1
5rz7GzaRLkE,the best song  ,1
IWts6eI7gDg,classic soft rock love songs 80s 90s  lionel richie eric clapton elton john mariah carey lobo ,1
TXGbhniTBrU,queen  we will rock you lyrics ,1
W1LsRShUPtY,old time rock amp roll ,1
UhbixyxgsiU,lil uzi vert  just wanna rock official music video ,1
GpBO64LU8wA,best soft rock songs 70s 80s 90s  lionel richie eric claptonphil collins bee gees celine dion ,1
lvVsuacsmvY,best slow rock 80s 90s playlist  the best slow rock songs of all time ,1
9PpXu-2fPHc,dream on ,1
W9jXA-atvAM,tx2  quotrandy mcnally no love like christian hatequot official video ,1
zSmySDrz9ko,daughtry  artificial official music video ,1
7XGHN5U3Voc,rock smasher  music video ,1
7ecE1oa7j2M,kid rock  johnny cash official music video ,1
s9uj17r9pVQ,ram pa pa pam ,1
pAgnJDJN4VA,acdc  back in black official video ,1
uGgMQkif_Xk,best slow rock love songs nonstop 80s 90s bon jovi scorpions aerosmith ac dc led zeppelin ,1
tgoPZKxCdGk,shinunoga ewa  fuji kaze electric guitar cover ,1
RY3AvEGKfZ0,beginner electric lesson 1  your very first electric guitar lesson ,1
TwIvUbOhcKE,how not to make an electric guitar the hazards of electricity ,1
IKglFgcZs64,acoustic vs electric guitar shorts ,1
hEOuGs7m8bw,electric guitars types everything you must know ,1
VjAnb2gBFVI,beginner electric guitar lesson 1 finger power chords ,1
N__seKQS2RA,eric clapton  wonderful tonight  electric guitar cover by kfir ochaion  jamzone app ,1
RdfrGR4IEl8,that39s what i like  bruno mars electric guitar cover ,1
H7AWRYDdOpE,tingin  cup of joe janine electric guitar cover ,1
3vXJc5SFW-I,acoustic vs electric guitar  marcin and ichika nito ,1
6Y3zYsLfFGw,michael jackson  beat it  electric guitar cover by kfir ochaion  spark ,1
56NL4-XvIIg,do i wanna know  arctic monkeys electric guitar cover ,1
M4lsB-B1O7U,joe satriani  made of tears from satriani live ,1
m5svhFCEF98,which guitar type is right for you ,1
eNcF_nKRkzw,beginner39s guide to electric guitar gear  guitars amps amp pedals ,1
6jrJ8a2Gjj8,odetari  gmfu w 6arelyhuman electric guitar ,1
pw401-BABhU,bon jovi  always  electric guitar cover by kfir ochaion  nux mighty lite ,1
3rT6yz9yTy0,bruno mars that39s what i like  electric guitar cover by vinai t ,1
vRXO6iUsbDs,electric guitar  chris brown ,1
8RKwo_fIdI0,guns n39 roses  sweet child o39 mine  electric guitar cover by kfir ochaion ,1
QH-IAPkgV2A,electric guitar explained in 2 minutes animation ,1
OzeoJlzkkPE,alan walker  faded  electric guitar cover by kfir ochaion    ,1
NzTMWEhjOV8,lady gaga  judas guitar cover ,1
maaQhzCOzhQ,michael jackson  beat it  metal guitar cover by kfir ochaion  evh guitars ,1
hRezta6mdFI,despacito  luis fonsi daddy yankee ft justin bieber  electric guitar cover by kfir ochaion ,1
GOCr09IXaLI,9 iconic guitar riffs you can learn almost instantly ,1
m3dYOsXbWII,easy electric guitar songs everyone should know how to play ,1
MPko_H32-zE,queen  don39t stop me now  electric guitar cover by kfir ochaion  hotone ampero mini ,1
KpPC1MHhMNE,expensive amp vs expensive guitar argument shorts ,1
E-rPB0c2uCs,moonlight  kali uchis electric guitar cover ,1
rHeKFsblHmU,comparing different guitar legends39 favorite guitars shorts ,1
bVbFc7I_ACc,5 things to check before buying a guitar ,1
9J38R0MNJaI,enchanted ,1
Q5JKjIetyjI,bon jovi  bed of roses  electric guitar cover by kfir ochaion  fender american pro ii ,1
HZ3t9vLxuDY,275000 vs 100 guitar worth it ,1
7hX7uz7K4Tg,5 guitars you think are good but they39re not ,1
H7U4IR6sONM,3 tips on choosing your next electric guitar shorts ,1
WSdEuYDztvw,which electric guitar type is for you ,1
XgwGBP9PKiw,i got my first electric guitar ahhh  a vlog unboxing my amp cute cat cafe my 1week progress ,1
kJr2f-ZY85M,nbsplvthe lost soul down electric guitar ,1
CV1WnRpt6MY,lady gagapoker face electric guitar ,1
w4a2ge9N31E,this should be everyones first guitar lesson ,1
NyKbZlmDQ68,3 months electric guitar progress selftaught ,1
IicGJ7EO1LM,my journey learning electric guitar  episode no 1  ,1
chCTI6BdyNk,shinunoga ewa  fujii kaze electric guitar cover byjade anne ahat ,1
bzbOWm0q79c,my daily guitar practice routine 2022 shorts ,1
F_cgoyruM8s,shinunoga ewa ,1
z-1Eo8P5eNw,wednesday morning jazz  relaxing of soft jazz music amp elegant fall bossa nova instrumental ,1
HTsdJM8fczc,wednesday morning jazz jazz autumn amp bossa nova sweet october to study work and relax ,1
Zch1X8nSTYk,jazz relaxing music  cozy coffee shop ambience  smooth jazz instrumental music  background music ,1
m9sF2HWWV0U,soft late night jazz music  ethereal piano jazz instrumental music  relaxing background music ,1
EkcCxLkHDzU,wednesday morning jazz october bossa nova cafe jazz  smooth amp relaxing instrumental music for work ,1
P_LGPntqKuQ,warm jazz  positive autumn bossa nova amp relaxing jazz instrumental music for upbeat mood ,1
w1ML9Jc_yMY,soft jazz music  relaxing october jazz coffee amp bossa nova for good mood ,1
jypMcNQQRXw,sweet october autumn morning  warm piano jazz music in bookstore cafe ambience for workstudyfocus ,1
T7qFkX1DZ_A,autumn warm jazz music in cozy coffee shop ambience  smooth piano jazz music to work study focus ,1
9UcFYb8Hcx0,jazz relaxing music to study work  cozy fall coffee shop ambience  smooth jazz instrumental music ,1
h8Z4bCJBYzk,relaxing jazz instrumental music for work study  cozy coffee shop ambience  soft piano jazz music ,1
v5RChTNlU-k,october morning jazz  elegant autumn bossa nova amp smooth jazz instrumental music for a good mood ,1
HGS6Z2mueaM,luxury saxophone jazz music in cozy bar ambience  best chill out sax piano jazz music for sleeping ,1
FOJfbb0O2js,jazz lounge feeling relaxing morning coffee music amp bossa nova piano smooth for improve moods ,1
zjUIlVKcJzA,warm jazz music for relaxing study cozy fall coffee shop ambience  smooth jazz instrumental music ,1
3rIDYTy_6Lw,sweet october jazz  exquisite autumn jazz  smooth jazz and relaxing bossa novastudy and work ,1
W43m8H0IPLo,quotpeaceful autumn cornerquot with slow smooth piano jazz music in cozy autumn garden cottage ambience ,1
8dFExnve2do,night jazz  los angeles  melody jazz music  relaxing ethereal piano jazz instrumental music ,1
xl0NMRAnqbA,relaxing jazz music for workfocus cozy coffee shop ambience  smooth piano jazz instrumental music ,1
8PqZ-FQfW-U,warm jazz music at cozy coffee shop ambience  relaxing jazz instrumental music  background music ,1
c9xtkAZSK50,motown jazz  smooth jazz music amp jazz instrumental music for relaxing and study  soft jazz ,1
7xsAIBpJnho,instrumental christmas jazz music at cozy christmas ambience amp smooth fireplace sounds to reaxsleep ,1
i-MNneoq-Gc,spooky background jazz music in cozy autumn cafe halloween ambience  fireplace sounds to sleeping ,1
QXm_Uz9LqFw,spooky halloween ambience  abandoned haunted houses village relaxing halloween jazz music to sleep ,1
5OkcAHGWsnk,cozy jazz  positive autumn day with relaxing jazz music amp smooth bossa nova for good mood ,1
a6jhL-VDHrY,slow october jazz  relaxing jazz instrumental amp delicate autumn bossa nova music for good mood ,1
pvpE7OHXfB8,autumn jazz  refreshing mood with warm and sweet jazz amp bossa nova coffee instruments in october ,1
If0JO1pkhmo,happy morning jazz  autumn day with jazz relaxing music amp smooth october bossa nova for good mood ,1
c3IVTi6TlfE,night paris jazz slow saxophone  relaxing music ,1
bUYUZ2MPJUU,morning jazz  autumn day with calm jazz music amp relaxing bossa nova for positive mood ,1
dUi48CPEVGA, cozy autumn bossa nova jazz  indulge in fall ambience with soothing jazz music  bgm ,1
K8x6uf4jfIc,sweet morning jazz  positive fall bossa nova amp relaxing jazz instrumental music for good mood ,1
neV3EPgvZ3g,relaxing jazz music  background chill out  music  music for relaxstudywork ,1
BnPpMRijMLQ,peaceful night jazz lounge with elegant jazz bar  jazz saxophone music for relax study amp work ,1
17vfdtr5i30,amp        l relaxing jazz piano music for office work study ,1
lJ7Cygun3Jk,relaxing jazz instrumental music to focuswork  cozy coffee shop ambience  smooth piano jazz music ,1
r0Wn2FVstMg,happy october fall morning in cozy bookstore cafe ambience  calm piano jazz music to focusworking ,1
tY2mglnPzx4,spooky background jazz music in cozy autumn cafe halloween ambience  night halloween to relaxsleep ,1
TejdEZ940lw,lightly october jazz  relaxing of smooth jazz music amp autumn bossa nova instrumental for good mood ,1
7LMT_1OYyH4,new york jazz lounge  relaxing jazz bar classics for relax study work  jazz relaxing music ,1
iGgAHJtG_KA,october fall morning amp relaxing smooth piano jazz music in bookstore cafe ambience to working study ,1
A1PSGBXCojo,sweet jazz instrumental music to studywork  cozy coffee shop ambience with smooth piano jazz music ,1
YZ7kiwHBXrg,relaxing jazz music for work study  cozy coffee shop ambience  calm piano jazz instrumental music ,1
R8aEbD38cbc,positive mood jazz  autumn day with relaxing jazz music amp sweet october bossa nova instrumental ,1
W1pbOW5LxWE,upbeat october jazz  relaxing jazz music amp sweet fall bossa nova instrumental for positive mood ,1
b9frx9WWVf8,october jazz  cozy autumn bossa nova amp smooth jazz instrumental music for positive mood ,1
hPqQD7uyEMQ,relaxing jazz music  october morning in cozy coffee shop ambience  smooth jazz instrumental music ,1
kU_sxHnZmPo,halloween night with smooth jazz music cozy coffee shop ambience  relaxing jazz instrumental music ,1
CDgxzo4dyFI,new york coffee shop ambience  relaxing jazz instrumental music for good mood work study ,1
bA5WYNtKOG4,elegant jazz  jazz and bossa nova october positive piano for relaxation study work concentration ,1
jCpsWvZowps,top 40 piano covers of popular songs 2023  best instrumental piano covers all time ,1
S8TvXhLtLa0,jvke  golden hour  piano cover by pianella piano ,1
LSwXh1Y5thY,alan walker  faded piano cover ,1
_T8vayGWIWo,best popular piano covers of popular songs 2023  most beautiful piano love songs  pop songs 2023 ,1
5LR5n6QYRPU,top 30 piano covers popular songs 2020  best instrumental piano covers all time ,1
IjfocYTF9EQ,coldplay  the scientist piano cover ,1
_SywaUbg5wU,africa  toto x peter bence piano cover ,1
sHhGngh8QDQ,top 30 piano covers of popular songs 2022  best instrumental music for work study sleep ,1
oS9uKFE4oUE,   mona    piano cover         ,1
eSjVVCmAJTE,fifty fifty  cupid  piano cover by pianella piano ,1
GmtTDvNcXcU,despacito piano cover  peter bence ,1
