id,title,Category
lFlu60qs7_4,how one line in the oldest math text hinted at hidden universes ,0
HeQX2HjkcNo,math39s fundamental flaw ,0
2WcbPcGrQZU,the history of mathematics documentary ,0
tLPL8pM8Xkw,why does vegas have its own value of pi ,0
B1J6Ou4q8vE,animation vs math ,0
igcoDFokKzU,addition and subtraction with dinosaurs  math for kids  math operations ,0
8cR_1Qi-tP4,meet the math facts  addition amp subtraction level 1 free  preschool prep company ,0
6r3Eqtl3nDM,colourful math for kids  numberblocks 1 hour compilation  123  numbers cartoon for kids ,0
_lfYn_p0Oho,maths vs physics ,0
RdzCXBgB-9s,mini math movies compilation  math video collection  scratch garden ,0
lA5Bw7Ir810,laissezmoi ken   barbie ,0
k9ZT2YWkLBI,meet the math facts  addition amp subtraction level 3 free  preschool prep company ,0
lbSgme6YdAs,mexico  a nice math olympiad exponential problem ,0
X4veT09-m94,math addition for 1st and 2nd grade ,0
24rZwis4npw,a playlist to romanticize studying math ,0
7c51zFHrjec,exciting football highlights  learn to count  30 mins of maths for kids  numberblocks ,0
3uzTABTaX5k,luxembourg  math olympiad question  you should know this trick ,0
TGXIZIe3Nzc,learn subtraction  30 minutes of subtraction  maths for kids  numberblocks ,0
ITOXb8K74is,math quiz for kids  one digit addition quiz  mental math quiz for kids  quiz time ,0
OQjkFQAIOck,maths quiz for kids  multiplication table quiz for kids  quiz time  ,0
P-sU9xkmZ5o,the history of mathematics documentary ,0
WcgV9qWE7qU,wendy alex and lyndon learn math amp numbers for the school exam  fun kids videos ,0
zAKStNdNn-U,catch the math  free maths classes for all railway exams 2023  class  60  maths by sahil sir ,0
JDGPnLfH1Io,stop doing math wtmmp ,0
mjlsSYLLOSE,basic math addition for kids  noodle kidz prek and kindergarten educational video ,0
8mve0UoSxTo,mathematics is the queen of sciences ,0
1v-wLVskEiQ,pythagoras39 theorem edit   shorts maths ,0
48pZWbXx-Hw,astronomy vs mathematics  science physics maths shorts ,0
6N0YPw7ogJw,asians could be all above average in math ,0
K04qorJ7t3o,unsolved mathematics questions  success motivational video shivam malik shorts ,0
rCIjp_irGqE,gce math paper 1 common exam questions ,0
iLXNBiGJAGs,quotmath whizquot addition song   danny go kids learning songs for kindergarten ,0
1SmwBwhvbFk,meet the math facts  addition amp subtraction level 2 free  preschool prep company ,0
AGKPeStDipE,math tests be like   4k memes  fyp viral ,0
7GYJGjujZ30,ce livre de maths cote 79124 ,0
iK0WcXNb7T0,maths tests be like  4k memes  shorts ,0
8rDpApFgukc,what color is math ,0
mRjKu4QwrE4,colourful math  full episodes  learn to count  numberblocks ,0
dP37Y6mddeQ,maths super tricks  dear sir  shorts maths shorttrick mathstricks examtrick ,0
I4pQbo5MQOs,the paradox at the heart of mathematics gdel39s incompleteness theorem  marcus du sautoy ,0
cjo84SNtoPQ,pourquoi apprendre les maths est dangereux  ,0
BpLDg9gs0Qw,the real reason why you39re bad or good at math ,0
EPe86sveyRY,the 7 levels of math ,0
IIyFLLLjybQ,meet the math facts  multiplication amp division level 2 free  preschool prep company ,0
SJD9MbgKe4g,10 divided by 2 times 5   many dont get this basic math concept order of operations ,0
362JVVvgYPE,fractions  mini math movies  scratch garden ,0
fb_v5Bc8PSk,how to selfstudy math ,0
qM7B2nwpV1M,subtraction for kids  learn how to subtract  mathematics for kids  ,0
qA4MykAXDF0,viral puzzle shorts puzzle math puzzles aptitude  iq  cupidtwinversion   puzzleguy ,0
tH_i76JVTDg,bbno  mathematics official video ,0
8Ir-zFC9nFE,mathematics ,0
YOyE3IfEj8w,lil mabu  mathematical disrespect live mic performance ,0
HeQX2HjkcNo,math39s fundamental flaw ,0
lFlu60qs7_4,how one line in the oldest math text hinted at hidden universes ,0
2WcbPcGrQZU,the history of mathematics documentary ,0
m5vw4ajnWGA,mos def  mathematics ,0
B1J6Ou4q8vE,animation vs math ,0
ksV8DbaI-50,awesome math iq testpart489 education tricks fun iq math mathematics shortvideo shorts ,0
ujvS2K06dg4,roger penrose  is mathematics invented or discovered ,0
zXV4GX6Whyw,lil mabu  mathematical disrespect official music video ,0
OmJ-4B-mS-Y,the map of mathematics ,0
tRaq4aYPzCc,mathematicians use numbers differently from the rest of us ,0
094y1Z2wpJg,the simplest math problem no one can solve  collatz conjecture ,0
dAgfnK528RA,math antics  order of operations ,0
igcoDFokKzU,addition and subtraction with dinosaurs  math for kids  math operations ,0
VN19VOMHxkk,does math reveal reality ,0
oDyviiN4NVo,grant sanderson 3blue1brown  past present amp future of mathematics ,0
KzfWUEJjG18,math antics  basic probability ,0
RdzCXBgB-9s,mini math movies compilation  math video collection  scratch garden ,0
8cR_1Qi-tP4,meet the math facts  addition amp subtraction level 1 free  preschool prep company ,0
P-sU9xkmZ5o,the history of mathematics documentary ,0
HdU_rf7eMTI,math antics  long division with 2digit divisors ,0
SJD9MbgKe4g,10 divided by 2 times 5   many dont get this basic math concept order of operations ,0
ITOXb8K74is,math quiz for kids  one digit addition quiz  mental math quiz for kids  quiz time ,0
qr6d_bC7jMI,learn mathematics like ramanujan did ,0
DnCkf93dLe0,3 plus 12 divided by 4squared times 2   basic math  focus on the order of operations ,0
NybHckSEQBI,algebra basics what is algebra  math antics ,0
8mve0UoSxTo,mathematics is the queen of sciences ,0
_lfYn_p0Oho,maths vs physics ,0
ubJD14AcGlc,75 will get wrong zero to 2nd power  zero to zero power   no calculator ,0
1v-wLVskEiQ,pythagoras39 theorem edit   shorts maths ,0
lbSgme6YdAs,mexico  a nice math olympiad exponential problem ,0
rCIjp_irGqE,gce math paper 1 common exam questions ,0
glzDphaGMOo,how does this turn into this maths ,0
6s09a6gag7g,meet the math facts  multiplication amp division level 1 free  preschool prep company ,0
R7oyZGW99os,hidden mathematics  randall carlson  ancient knowledge of space time amp cosmic cycles ,0
3uzTABTaX5k,luxembourg  math olympiad question  you should know this trick ,0
mgsikzqbiWM,99 of math students get this step confused ,0
k9ZT2YWkLBI,meet the math facts  addition amp subtraction level 3 free  preschool prep company ,0
48pZWbXx-Hw,astronomy vs mathematics  science physics maths shorts ,0
OQjkFQAIOck,maths quiz for kids  multiplication table quiz for kids  quiz time  ,0
1SmwBwhvbFk,meet the math facts  addition amp subtraction level 2 free  preschool prep company ,0
k6Xe2f8UKFY,can you identify the mathematical equation iitstatus motivation mathematics upsc neet toppers ,0
I4pQbo5MQOs,the paradox at the heart of mathematics gdel39s incompleteness theorem  marcus du sautoy ,0
24rZwis4npw,a playlist to romanticize studying math ,0
zAE0Fhmwh7k,7 greatest mathematicians in history  hex planet ,0
JDGPnLfH1Io,stop doing math wtmmp ,0
7soDA7W9J9k,math genius ,0
Nmgl78a02ys,202239s biggest breakthroughs in math ,0
szI-HpOScFQ,the weight of nothing could mean everything to physics ,0
bIXN8TMaVUA,quantum physics the science that defies all logic  secrets of quantum physics  progress ,0
5e83QRGoRCo,why did attosecond physics win the nobel prize ,0
DxL2HoqLbyA,the most misunderstood concept in physics ,0
w2ILA2P_n6M,the 4 greatest mysteries of physics ,0
AZsmyTE3j9o,the mindbending physics of time  sean carroll ,0
yLOHdW7dLug,can a new law of physics explain a black hole paradox ,0
K5Po5R-1rgY,mindblowing facts about our reality 4k  the secrets of quantum physics  spark ,0
b1t41Q3xRM8,physics  basic introduction ,0
4hddxkhta3w,physicists proved the universe doesn39t exist ,0
lu4mH3Hmw2o,what39s going wrong in particle physics  this is why i lost faith in science ,0
FdCaSua_GLI,faster than we thought possible  nobel prize in physics 2023 explained ,0
iE-M56CVJx4,physics for absolute beginners ,0
TTHazQeM8v8,all physics explained in 15 minutes worth remembering ,0
TAhbFRMURtg,theoretical physicist brian greene explains time in 5 levels of difficulty  wired ,0
NfmSjGbnEWk,attosecond lasers 2023 nobel prize in physics  sixty symbols ,0
y3cw_9ELpQw,andrew strominger black holes quantum gravity and theoretical physics  lex fridman podcast 359 ,0
SDxzZHSBhw0,neil degrasse tyson explains the weirdness of quantum physics ,0
11lPhMSulSU,physics crackpots a 39theory39 ,0
WiWsnItm9JU,become god of physics in 3 months  target iit bombay  ,0
W12VIctCVb8,iceberg of unsolved mysteries in physics ,0
Lm9SZf2XFCc,fundamentals of quantum physics basics of quantum mechanics  lecture for sleep amp study ,0
K-Fc08X56R0,3 perplexing physics problems ,0
iSV3lee-JOc,these substances 39defy the laws39 of physics ,0
1gyfoJGmmrc,the greatest mysteries in physics  asmr ,0
RCSSgxV9qNw,why is 1137 one of the greatest unsolved problems in physics ,0
dHjWVlfNraM,kinematics in one dimension  physics ,0
Dt5cFLN65fI,why neil turok believes physics is in crisis ,0
kKKM8Y-u7ds,newton39s laws crash course physics 5 ,0
SUF4ii7CIlw,physicvtzim100000 ,0
_lfYn_p0Oho,maths vs physics ,0
ZihywtixUYo,the map of physics ,0
9SFQ7k5m4-4,this discovery just won the nobel prize in physics ,0
NyfNxspBfsc,why does quantum entanglement defy all logic  secrets of quantum physics  progress ,0
EwSHKuSxX_8,vectors  basic introduction  physics ,0
Usu9xZfabPM,if you don39t understand quantum physics try this ,0
YVt_nZ-fSU0,gravity is really weak  physics science astronomy astrophysics ,0
068rdc75mHM,einstein39s quantum riddle  full documentary  nova  pbs ,0
US7fEkBsy4A,why did quantum entanglement win the nobel prize in physics ,0
tBwFRnTzcYY,a day in the life of a physics major ,0
X5vdw2B9DY0,new ramayan movie ft ranbir kapoor amp rocky bhai ,0
ZM8ECpBuQYE,motion in a straight line crash course physics 1 ,0
GfSMV84EbgE,isaac newton edit physics science edit status shorts ,0
TkZmaamYDSI,khan sir vs physics wallah i youtuber39s comparison i shorts i khansir i physicswallah ,0
bUmULlGACEI,dr michio kaku answers physics questions from twitter  tech support  wired ,0
jhwvCKrUq9U,does the spinning wheel defy gravity no it obeys physics funny fyp reels shorts shortsvideo ,0
iQOibpIDx-4,the physics of ufos eric weinstein  hal puthoff ,0
i_CijGuk7fw,01  introduction to physics part 1 force motion amp energy  online physics course ,0
dTqoQ9wC5BE,kelly clarkson  chemistry official audio ,0
RgGWoxRBvsg,the deadly chemistry that made life interesting ,0
-1PuK8mxASE,lessons in chemistry  official trailer  apple tv ,0
FSyAehMdpyI,the nucleus crash course chemistry 1 ,0
Rd4a1X3B61w,introduction to chemistry  atoms compounds and ions  chemistry  khan academy ,0
ftACSEJ6DZA,chemistry is dangerous ,0
-KfG8kH-r3Y,chemistry ,0
5GKOiu07uF4,chemistry  pieces of a dream point of no return  tft fes vol3 supported by xperia amp 1000x series ,0
msTvnlsdA48,unc building chemistry by bonding off the court  202324 acc tipoff ,0
P3RXtoYCW4M,the map of chemistry ,0
0g8lANs6zpQ,the magic of chemistry  with andrew szydlo ,0
bka20Q9TN6M,intro to chemistry basic concepts  periodic table elements metric system amp unit conversion ,0
ti_E2ZKZpC4,chemical curiosities surprising science and dramatic demonstrations  with chris bishop ,0
k3rRrl9J2F4,01  introduction to chemistry  online chemistry course  learn chemistry amp solve problems ,0
pdyDmXtye2w,intro to chemistry amp what is chemistry  111 ,0
F5pl6VmXgpA,which chemical do i hate the most ,0
B_ketdzJtY8,organic chemistry  basic introduction ,0
asAd-E5_HPo,chemist breaks down 22 chemistry scenes from movies amp tv  wired ,0
Vd6zKWjUNJc,science max  full episode  chemistry  season 1 ,0
OCFmQd15SRo,testing insane chemistry recipes from a 1933 formulary book part 3 ,0
SsEHgLNFGVk,chemistry prod czaer ,0
HgBOYDriGGc,chemistry  my gift to you  the first take ,0
NIVkBs7oWDI,turning paint thinner into cherry soda ,0
LmAG8-V_WQY,making the stinkiest chemical known to man ,0
7qzgptpuxvw,twinpearly  chemistry ft sejo san official video ,0
j9rLiSLIsh4,ati teas version 7 science chemistry how to get the perfect score ,0
fIM6943BSRA,testing crazy chemistry recipes from a 1933 formulary book part 4 ,0
trgDHBPLJEE,15 incredible chemical reactions ,0
QXT4OVM4vXI,atomic hookups  types of chemical bonds crash course chemistry 22 ,0
0RRVV4Diomg,the periodic table crash course chemistry 4 ,0
t8x3wdXZGEY,what is chemistry ,0
lQ6FBA1HM3s,redox reactions crash course chemistry 10 ,0
H2b8LYMUYTE,chemistry 2023 ,0
K6FgSUyGtKc,the7  chemistry  official mv ,0
n6wpNhyreDE,the chemistry of cookies  stephanie warren ,0
ckSoDW2-wrc,the 5 most dangerous chemicals on earth ,0
gNUXcRB4mdw,basics of inorganic chemistry  quantum numbers and electronic configuration  neet 2024  akansha ,0
bOuEJf8Dr_4,25 chemistry experiments in 15 minutes  andrew szydlo  tedxnewcastle ,0
jb4CMnT2-ao,6 chemical reactions that changed history ,0
wjgU0vQ5OaU,twinpearly  chemistry ft sejo san official visualizer ,0
IzPQ_jA00bk,post malone  chemical official music video ,0
D0MZUgBUdyM,asher angel  chemistry official video ,0
G4b6zAypaRw,science max  chemical reactions  experiments ,0
rcKilE9CdaA,the electron crash course chemistry 5 ,0
4V0cIzS9Aj0,lil tecca  chemistry official lyric visualizer ,0
56f4PLWghm8,complete chemistry for ssc cglchsl mains 2023  delhi police 2023  parmar ssc ,0
Wg-2ceZA-yU,sslc chemistry  one shot series  production of metals    chapter 4   exam winner ,0
FBvjro4-7yc,never pour water into acid  shorts science chemistry ,0
8m6RtOpqvtU,what triggers a chemical reaction  kareem jarrah ,0
4ekf0J-W5k0,branches of chemistry ,0
I7_e8p8SXIk,improve english speaking skills everyday tips to speak in english english conversation practice ,0
hrGRog5BTjc,let39s learn english on a hike  ,0
OXmnrfj2ERc,24 hours listening practice level 4  improve vocabulary  american english conversation  ,0
auBbCFDcFXI,think and speak english  how to answer any question like a native english speaker ,0
5A2fI9fzJtc,improve your english fluency  tips for speaking english with confidence ,0
m8lLwZU9COg,advanced english conversation education in the us ,0
LymGUEgscTk,200 important english expressions english vocabulary lesson ,0
7R1HkpcMVAM,english for school ,0
OtWciKwlaG8,do you have 60 min you can speak like a native english speaker ,0
28U3deacl0o,25 smart sentences for daily use in english conversation  improve english conversation skills ,0
vFEnokHzFm4,improve your english listening skills in 30 minutes ,0
XVP5grTsJZ0,everyday life english conversation ,0
DNCMVOlZgV0,top hits 2023  new popular songs 2023  best english songs  best pop music playlist  on spotify ,0
pZR5Ox8duog,practice english listening for beginners  improve your listening skills every day ,0
2kDdhv5arIk,30 minutes to improve english fluency  daily english conversations ,0
cfFRxsQAbAc,improve your english  english story  a girl in a cafe  the stolen sketchbooks  level 3 ,0
IBhWKbKfLeA,learn english  the best british speeches english subtitles ,0
OQ0k9rIFoVE,learn english through story  level 3  albert einstein  graded reader  wooenglish ,0
AnhRKaLVR3Y,6 great tv series for expanding your english vocabulary  podcast ,0
VJBRtauXHnQ,daily english conversation practice  improve speaking skills fluently everyday ,0
w_ysxZqQoXg,basic english conversation practice for kids  chapter 1 to 20 ,0
Hcuq9ak6uig,lisa is homeless  conversation in english  english communication lesson ,0
DB_v5JLCBQI,watch this every day to program yourself for english fluency amp success ,0
Emdc5LIhHa4,the 50 important phrasal verbs in english ,0
LeAV7kdIVXM,how to use the preposition quotinquot  learn english grammar for beginners ,0
KcTMbapo-9I,when english is your second language ,0
GnQ1caXSZcg,think in english and speak confidently your ultimate english learning course ,0
aq9o4PVmGcs,speak english fluently with these 9 words ,0
pi5L2rmz4m8,30 minutes with english speaking conversations ,0
jEPm1sB-j10,lisa is sued  conversation in english  english communication lesson ,0
jj04bHCHAoE,learn english through story level 1  rich man poor man  improve english conversation skills ,0
6otBnS2SXhU,let39s learn english topic sleep  lesson only ,0
Y681hXWwhQY,the benefits of doing nothing  6 minute english ,0
-4xg7hCsBtM,homeless mom part 5  english story  learn english  animated stories  sunshine english ,0
f7Aumw-E9w8,speak english 247 with englishclass101 tv  live 247 ,0
wb7191WNvus,basic vs advanced english ,0
MMZengqEunA,fake rainbow hair  princess story fairy tales in english woafairytalesenglish ,0
bHoAx7giqi8,real english conversation  fast english ,0
NiF8nhDqhfE,the school trip  conversation in english  english communication lesson ,0
henIVlCPVIY,everyday english conversation practice  30 minutes english listening ,0
_-i9SDYeC8U,formal english phrases for everyday conversation ,0
O9S70oJAivI,learn all the tenses in english complete course ,0
hZsM7fD9b80,basic english conversation practice for kids  chapter 21 to 35 ,0
n57C3xRUoa8,rema selena gomez miley cyrus sza taylor swift maroon 5 ed sheeranbillboard top 50 this week ,0
siKd0SU0RfU,practice english conversation how to earn much money improve english speaking skills ,0
n434ha4QwU0,english speech  mark zuckerberg free speech english subtitles ,0
FqXrBy_FIU0,halloween night tonight english ver  hololive english advent cover ,0
RWHOxYxyBb4,learn english with podcasts  advanced vocabulary ,0
whcotbtdeAs,rbi assistant amp sbi clerk 2023  english mock test 12  english by santosh ray ,0
Wxw8LA2GqAE,back to school extravaganza  every episode live  best kids learning amp educational entertainment ,0
LWm-Th4-Ahs, wheels on the bus  nursery rhymes amp kids songs  toddler learning video  ms rachel ,0
hTqtGJwsJVE,baby learning with ms rachel  first words songs and nursery rhymes for babies  toddler videos ,0
3yXlvkpov1c,grade 1 songs  learning song collection  scratch garden ,0
xkYved-ucGg,learn to talk with ms rachel  videos for toddlers  nursery rhymes amp kids songs  speech practice ,0
50klx9Q5ls8,baby learning videos  babies and toddlers learn colors first words shapes abc  lucas amp friends ,0
zmEv7vTOQGE,baby learning with ms rachel  baby songs speech sign language for babies  baby videos ,0
Ms0VqM4xi4U,learn letters  letter a  counting song  colors  songs for kids  back to school ,0
UuLZ27M6JCo,learning collection by brain candy tv vol 1 learn english numbers colors and more ,0
TyV-OhCrVDA,learn colors fruits and vegetables with ms rachel  toddler learning video  speech  educational ,0
VxBEmaaSh1c,one syllable words  phonics for kids  learn to read  alphablocks ,0
kKvK2foOTJM,brain hack 6 secrets to learning faster backed by neuroscience  lila landowski  tedxhobart ,0
4HUCJliVbsw,the best of toddler fun learning  learning videos for toddlers ,0
-4UYlu3Z3i8,blippi goes inside a volcano educational videos for kids ,0
hOHrqPI9bVk,learn numbers colors counting and shapes with ms rachel  learning videos for toddlers in english ,0
FuRb_H-H9KY,toddler learning  learn colors numbers amp shapes  songs for kids  toddler lesson   episode 2 ,0
DuLgP9qcTn4,msrachel and blippi learning adventure  indoor play with friends  educational videos for kids ,0
INYqyOPAP9Y,toddler learning video with ms rachel  2 year old milestones speech amp social skills for toddlers ,0
g6CVApMxmqg,phonics counting colors  more kids learning songs amp nursery rhymes  gracies corner compilation ,0
7D4K9oi7oBM,top 10 counting songs  learn to count  super simple songs ,0
drlIUqRYM-w,learning abc letters and basic english vocabulary ,0
9_WBQISVHnw,best learning video for toddlers learn colors with crayon surprises ,0
NZlJ6Saq-S4,best toy learning videos for toddlers  family friendly preschool videos for kids ,0
HJLNtge8jv4,blippi learns colors amp letters for kids with clay  educational videos for kids ,0
kIoD2MPKVrw,learning at home with bebefinn family nursery rhymes  numbers shapes colors and more ,0
DWkrzDG5u_0,learn colors numbers amp shapes  kids songs  toddler lesson  kiwico special ,0
ZdRzq5npaIo,learn countries with chris and mom  kids adventures ,0
OTuph9pJWU4,best learning videos for kids  the drbinocs show  fun learning videos for kids  by peekaboo kids ,0
_R0xRT2y7Uo,learn the alphabet letters phonics song  toddler learning video  letter sounds  speech  abcs ,0
ILPjPIFNsRA,learn letters chain reactions physics recycling and more  7 cartoons with max and friends ,0
yEzuFQdmNrs,learn letters numbers shapes  songs for kids  special preschool  lesson  circle time lesson ,0
7i68cD70dEE,learn colors abcs and 123 songs   more educational nursery rhymes amp kids songs  cocomelon ,0
YTSBZJWuTQk,best learning videos for toddlers  learn shapes for children with fun play wooden toy truck ,0
T9ViFtzplf8,abc song counting numbers amp learn colors for kids  more educational videos for toddlers ,0
gFuEoxh5hd4,blippi amp ms rachel learn vehicles  wheels on the bus  videos for kids  tractor car truck  more ,0
5MgBikgcWnY,the first 20 hours  how to learn anything  josh kaufman  tedxcsu ,0
COIw9e834Ag,learn food for kids  blippi and the chocolate factory  educational videos for children ,0
XtHZ_8ILGgY,learn to talk  toddler learning video  learn colors with crayon surprises   speech delay  baby ,0
Rr0uFzAOQus,learn abcs with morphle and mila  learning videos  cartoons for kids  morphle tv ,0
6DDbzqYKNh0,finish the sequence  numberblocks  learn to count  123  numbers cartoon for kids ,0
2vYqjQnm3WY,preschool learning videos  preschool for littles  online virtual preschool video  learn at home ,0
Vb2ZXRh74WU,storybots outer space  planets sun moon earth and stars  solar system super song  fun learning ,0
H-9eydT066s,learning videos for toddlers  learn abc39s colors numbers shapes months of the year amp more ,0
y6Fo4i_pLyc,toy learning video for toddlers  learn spanish colors shapes and numbers with a birthday cake ,0
AjgD3CvWzS0,tutitu compilation  numbers amp letters  fun learning videos for children ,0
UbYpfxrkqHo,let39s read  reading comprehension  kinder and grade 1  teaching mama ,0
Gh-XKNuvvC4,learning with blippi at kinderland indoor playground for kids  educational videos for toddlers ,0
C7oebqj3PCY,how to write letters for children  teaching writing abc for preschool  alphabet for kids ,0
NN8gsI2FBQw,letter teams  oo amp oa  phonics for kids  learn to read  alphablocks ,0
xPq1KrYWbqo,days of the week  chuchu tv surprise eggs learning videos for kids ,0
Is2Lip1cJUc,extreme breathholding ,0
lFlu60qs7_4,how one line in the oldest math text hinted at hidden universes ,0
ILgSesWMUEI,all the times we nearly blew up the world ,0
QQkmJI63ykI,the man who killed millions and saved billions clean version ,0
8DBhTXM_Br4,how the most useless branch of math could save your life ,0
ZjBgEkbnX2I,should airships make a comeback ,0
FkKPsLxgpuY,i took an iq test to find out what it actually measures ,0
Xzv84ZdtlE0,why oppenheimer deserves his own movie ,0
DxL2HoqLbyA,the most misunderstood concept in physics ,0
SeqKSRRpAH8,el hombre que mat y salv a millones ,0
O3WiD6X2-9M,cmo la rama ms intil de la matemtica podra salvar tu vida ,0
lfkjm2YRG-Q,the hidden science of fireworks ,0
tRaq4aYPzCc,mathematicians use numbers differently from the rest of us ,0
ZMQbHMgK2rw,the fastest mazesolving competition on earth ,0
hRLMIFZWqnw,pocos entienden esto de la fsica moderna ,0
FU_YFpfDqqA,why the first computers were made out of light bulbs ,0
vSNtifE0Z2Q,how nasa reinvented the wheel ,0
6bgNm9l_3qU,i vacuum venom from the world39s deadliest spider ,0
iSNsgj1OCLA,the riddle that seems impossible even if you know the answer ,0
rWVAzS5duAs,getting buried in concrete to explain how it works ,0
esQyYGezS7c,the world depends on a collection of strange items they39re not cheap ,0
nmgFG7PUHfo,the remarkable story behind the most important algorithm of all time ,0
OxGsU8oIWjY,how an infinite hotel ran out of room ,0
IV3dnLzthDA,the man who accidentally killed the most people in history ,0
q-_7y0WUnW4,i rented a helicopter to settle a physics debate ,0
XeSu9fBJ2sI,193340 people agree with me 85660 disagree ,0
daaDuC1kbds,world39s highest jumping robot ,0
j5v8D-alAKE,this is why we can39t have nice things ,0
4c8vG-mxuao,cmo puede quedarse sin lugar un hotel infinito  veritasium en espaol ,0
094y1Z2wpJg,the simplest math problem no one can solve  collatz conjecture ,0
HeQX2HjkcNo,math39s fundamental flaw ,0
16Ci_2bN_zc,how dangerous is a penny dropped from a skyscraper ,0
K-Fc08X56R0,3 perplexing physics problems ,0
kTXTPe3wahc,parallel worlds probably exist heres why ,0
t-_VPRCtiUg,the surprising secret of synchronization ,0
pTn6Ewhb27k,why no one has measured the speed of light ,0
pXoZQsZP2PY,how to measure the tiniest forces in the universe ,0
6etTERFUlUI,the absurd search for dark matter ,0
_k9egfWvb7Y,world39s heaviest weight ,0
ovJcsL7vyrk,this equation will change how you see the world the logistic map ,0
rjDX5ItsOnQ,how was video invented ,0
cUzklzVXJwo,how imaginary numbers were invented ,0
dBap_Lp-0oc,the illusion only some people can see ,0
yCsgoLc_fzI,a physics prof bet me 10000 i39m wrong ,0
KT18KJouHWg,how they caught the golden state killer ,0
CM0aohBfUTc,veritasium a story of youtube propaganda ,0
n8WxkqMRgS4,falling ladders  why does this happen ,0
bHIhgxav9LY,the big misconception about electricity ,0
O-WCZ8PkrK0,how right is veritasium don39t electrons push each other ,0
66tfvFeALBQ,how to actually learn to code 7 roadmaps for 2023 ,0
a0eB7tMkvs4,how to code everyday ,0
WR1ydijTx5E,how i learned to code in 4 months amp got a job no cs degree no bootcamp ,0
N775KsWQVkw,how to program  getting started ,0
bJzb-RuUcMU,how to learn programming for beginners 20222023 ,0
NtfbWkxJTHw,how to learn to code  8 hard truths ,0
xxutllvXwaM,how i would learn to code if i could start again ,0
6qclmwwqTlY,how michael reeves learned to code ,0
k9WqpQp8VSU,how i would learn to code if i could start over ,0
NSCNSwFFq6I,how to learn to code in 2023 ,0
QMbx0dTWJIQ,stop studying programming ,0
KsXp22QLMv0,fastest way to learn coding and actually get a job ,0
MHPGeQD8TvI,how i would learn to code if i could start over ,0
zOjov-2OZ0E,introduction to programming and computer science  full course ,0
