title,summary,category
"Agnes Keith, Countess of Moray",Agnes Keith Countess of Moray c 1540  16 July 1588 was a Scottish noblewoman She was the wife of James Stewart 1st Earl of Moray regent of Scotland and the illegitimate halfbrother of Mary Queen of Scots making her a sisterinlaw of the Scottish queen As the wife of the regent Agnes was the most powerful woman in Scotland from 1567 until her husbands assassination in 1570She was married secondly to Sir Colin Campbell heir presumptive to the earldom of Argyll When he succeeded his brother as the 6th earl in 1573 Agnes was henceforth styled Countess of Argyll During her second marriage Agnes became embroiled in a litigation over Queen Marys jewels which had earlier fallen into her keeping It was her refusal to hand the jewels over to the Scottish Government that sparked a feud between the Earl of Argyll and the Regent Morton Agnes was also known as Annabel or Annas Some recent historians prefer to use the name Annas Keith reflecting a contemporary spelling ,-1
"Keller, Georgia",Keller is a small unincorporated community located in southern Bryan County Georgia United States east of Richmond Hill Its boundaries are illdefined but the community could be said to be centered on the intersection of SR 144 and BelfastKeller Road Currently the area like most of South Bryan is an unincorporated community of extensive residential development with a number of planned neighborhoods However Keller also has a significant historical aspect It is near Fort McAllister Historic Park an earthen Civil War installation captured by General William Sherman on his March to the Sea Bryan Neck Presbyterian Church established in 1839 and rebuilt in 1885 is listed on the National Register of Historic Places and is located on BelfastKeller Road about a mile from the SR 144 intersection A number of antebellum plantation houses or sites exist along the marshes and waterfront areas of extreme south Bryan County though none are in public hands or are preserved as historic sites The community is part of the Savannah Metropolitan Statistical Area ,-1
Jošan,Joan Serbian Cyrillic  or Joani is a village in Krbava Croatia It is located on the D1 highway between Peani and Udbina ,-1
New Zealand cricket team in Pakistan in 1964–65,The New Zealand national cricket team toured Pakistan in March to April 1965 and played a threematch Test series against the Pakistan national cricket team Pakistan won the Test series 20 New Zealand were captained by John Reid and Pakistan by Hanif Mohammad ,-1
"Yeşilköy, Çine",Yeilky is a neighbourhood in the municipality and district of ine Aydn Province Turkey Its population is 147 2022  References  ,-1
International Society for Comparative Psychology,The International Society for Comparative Psychology was founded in 1980 and held its first meeting in 1983 ,-1
Finnish motorcycle Grand Prix,The Finnish motorcycle Grand Prix was part of the FIM Grand Prix motorcycle racing championship from 1962 to 1982 It was held at the Tampere Circuit in 1962 and 1963 before moving to the Imatra Circuit Giacomo Agostini won the most Finnish Grands Prix with ten 500cc victories and seven 350cc victories In July 2016 it was announced the Grand Prix would return on the new Kymi Ring circuit After a 5year contract was agreed to start with a scheduled event in 2021 this was cancelled on 14 May 2021 due to COVID19 The next anticipated event for 2022 was cancelled on 25 May 2022 due to incomplete homologation works at the track and the risks associated with the geopolitical situation in the region concerning the 2022 Russian invasion of Ukraine The MotoGP 2023 provisional race calendar was announced in late September 2022 without the Finnish Grand Prix ,-1
Keithellakpam,Keithellakpam is a Meetei Manipuri surname or family name which has Indian origin People of this family mainly inhabit in Manipur IndiaTheir mythical progenitor was Thamanglang ,-1
Jericho (Prism album),Jericho is the seventh studio album by Canadian rock band Prism It was originally released in 1993 Most of the tracks were recorded in 1993 however the songs Good to Be Back and Way of the World were recorded and released as a single in 1988 after the group reformed The album was recorded and mixed at Mushroom Studios in Vancouver except for tracks 2 and 3 which were recorded by Jim Vallance at Distorto Studios in Vancouver ,-1
Jukka Toivola,Jukka Olavi Toivola 7 September 1949  27 May 2011 was a male longdistance runner and teacher of chemistry from Finland Born in Liperi North Karelia Toivola represented his native country at the 1976 Summer Olympics in the mens marathon finishing in 27th place In 1979 he won the first edition of the Stockholm Marathon Toivola died in 2011 in Pori after suffering from ALS since 2007 ,-1
"Magnus II, Earl of Orkney",Magnus II c 1185 or 1190  1239 was the first in the Angus line of Scottish earls or jarls of Orkney His title was Earl of Orkney and Caithness He was the son of Gille Crst Earl of Angus and his second wife Ingibiorg Ericsdottir of Caithness Ingibiorg was the granddaughter of Orkneyar Jarl Rgnvald Kali Kolsson Magnus was granted the Earldom of Orkney by King Haakon IV of Norway in 1236 following the death of Jon Haraldsson in 1231 despite there being several other claimants to the jarldom The first Magnus of Orkney was St Magnus Erlendsson who ruled from 1108 to about 1117 He died three years later and was succeeded by his son Gilbert  References  ,-1
Cape Alexandra,Cape Alexandra 540S 380W is a cape which forms the northwest extremity of South Georgia It was named Cape North in 1775 by a British expedition under James Cook but this name has since become established for a cape 10 nautical miles 20 km eastnortheast which forms the northernmost point of South Georgia The name Cape Alexandra dates back to about 1912 and commemorates Queen Alexandra Consort of King Edward VII of the United Kingdom ,-1
All Saints' Catholic Academy,All Saints Catholic Academy formerly All Saints RC School is a Roman Catholic secondary school in Mansfield Nottinghamshire England It is the only Catholic secondary school in the district with a capacity for over 1000 students The school is allied to St Philip Neri with St Bedes Catholic Voluntary Academy for younger pupils aged 311 years ,-1
Oniiwe,Oniiwe is a small settlement in northern Namibia Onayena Constituency situated in Oshikoto Region in the Ondonga area the village has schools including Oniiwe Primary School Uuyoka Junior Primary School also known as Mateus Namwiha Primary School Ambunda Primary School which comprises grades 1 to 7 The economy is based on substance farming It is one of the biggest villages in Onayena neighboring settlements are Uuyoka Uukete Oniimwandi Ompugulu among others The village is without infrastructures such as a clinic or a road but was electrified in 2007  References  ,-1
Masters Tournament Par 3 Contest,The Masters Tournament Par3 contest is a golf competition that precedes the Masters Tournament at Augusta National Golf Club in Augusta Georgia The first Par3 contest was held before the 1960 tournament and was won by threetime Masters champion Sam Snead The contest takes place in a single round on a ninehole par27 course in the northeast corner of the clubs grounds designed in 1958 by George Cobb and club founder Clifford RobertsTraditionally the contest participants have invited family members to caddie for them sometimes allowing them to play shots on their behalf Through the 2019 contest ninetyfour holes in one have been recorded including nine in the 2016 eventSnead became the contests first multiple winner in 1974 fourteen years after his first The most recent is Tom Watson who won his second Par3 contest in 2018 36 years after his first in 1982 Pdraig Harrington is the only one with three wins he won his first pair in consecutive years 2003 2004 as did Sandy Lyle 1997 1998 Seven players have multiple wins the other three are Isao Aoki Jay Haas and David Toms Jimmy Walker holds the course record of 19 8 set in 2016 which included an ace The contest has been decided by a playoff on 21 occasions and concluded with a tie twice Just 14 of the 59 winners including ties are nonAmerican No winner of the Par3 contest has gone on to win the Masters in the same year ,-1
Nyssodrysternum rodens,Nyssodrysternum rodens is a species of beetle in the family Cerambycidae It was described by Bates in 1864  References  ,-1
Davinia Esther Anyakun,Davinia Esther Anyakun born 19 April 1976 is a Ugandan female politician and a procurement and logistics professional She has been the woman Member of Parliament for Nakapiripirit District since 2016 She is a member of the National Resistance Movement a political party led by Yoweri Museveni the President of Uganda ,-1
KV IIT Chennai,KV Kendriya Vidyalaya IIT Chennai is an Indian Institute of Technology IIT secondary school affiliated to CBSE board in Chennai India The current principal is MrRNSendhil Kumar It was established on 1964 It is part of the Kendriya Vidyalaya SangathanIt encourages holistic development ,1
House of Dunkeld,The House of Dunkeld in Scottish Gaelic Dn Chailleann lit Fort of the Caledonii or of the Caledonians is a historiographical and genealogical construct to illustrate the clear succession of Scottish kings from 1034 to 1040 and from 1058 to 1286 The line is also variously referred to by historians as The Canmores and MacMalcolm It is dynastically sort of a continuation to Cenl nGabrin of Dl Riata race of Fergus as house was an originally Celtic concept to express one of the two rival leading clans of early medieval Scotland whose founding father is king Fergus Mor of Dalriada This Ferguside royal clan had disputed the crown of Dalriada then that of Alba against the Cenl Loairn the later House of Moray for the preceding four or more centuries The Cenl nGabrin were represented by the House of Alpin before DunkeldSir Iain Moncreiffe made the case that Crnn of Dunkeld was actually a kinsman of Saint Columba and thus a member of the Irish Cenl Conaill a royal branch of the Northern U Nill dynasty Christopher Cairney makes the case for a different U Nill descent in the Cenl nEgain This does not exclude Crnns descendants from also being a female line continuation of the Cenl nGabrin through Bethc The Dunkeld dynasty is genealogically based on Duncan I of Scotland being of a different agnatic clan to his predecessor and maternal grandfather Malcolm II of Scotland However sociohistorically the reign of Duncans son Malcolm III of Scotland which happens to coincide with the start of the centurieslong period of strong influence from the southern neighbour the Kingdom of England has been seen as a more important place to start ,-1
Morris Park station (Metro-North),Morris Park station is a planned passenger rail station on the MetroNorth Railroad New Haven Line to be located in Morris Park Bronx The station is planned to open in 2027 as part of the Penn Station Access project It will be located at Morris Park Avenue adjacent to the Albert Einstein College of Medicine with entrances from both sides of the tracks ,-1
Stanley J.F. Philpott,Stanley John Francis Philpott 18881952 was a British psychologist and educator Philpott trained as a teacher in Exeter and spent many years in the teaching profession He also conducted research on mental efficiency which involved the administration of a range of intelligence tests he developed and their measurement over time In 1932 he was awarded a DSc by the University of London for this work The findings were published in a monograph of the British Journal of Psychology Twenty years later there was further discussion about his work in an issue of that journalPhilpott was for many years Treasurer and then President of the British Psychological Society He ensured that the growing society was on a clear financial basis and also convinced the British Board of Trade that the name which the Society had held for 25 years should be formally registered He also served on the boards of the British Association for the Advancement of Science ,-1
"Solar eclipse of May 20, 2069",A partial solar eclipse will occur on May 20 2069 A solar eclipse occurs when the Moon passes between Earth and the Sun thereby totally or partly obscuring the image of the Sun for a viewer on Earth A partial solar eclipse occurs in the polar regions of the Earth when the center of the Moons shadow misses the Earth This event will mark the beginning of Solar Saros 158 This is the third eclipse this season First eclipse this season April 21 2069  Partial Solar Eclipse Second eclipse this season May 56 2069  Total Lunar Eclipse ,-1
Frank Vining Smith,Frank Vining Smith 1879  July 30 1967 was an American marine painter who specialized in sailing ships His paintings can be seen at the Eastern Yacht Club and the Grosse Pointe Yacht Club  References  ,-1
Marc T. Treadwell,Marc Thomas Treadwell born August 6 1955 is the Chief United States district judge of the United States District Court for the Middle District of Georgia ,-1
Virosphere,Virosphere virus diversity virus world global virosphere was coined to refer to all those places in which viruses are found or which are affected by viruses However more recently virosphere has also been used to refer to the pool of viruses that occurs in all hosts and all environments as well as viruses associated with specific types of hosts prokaryotic virosphere archaeal virosphere Invertebrate virosphere type of genome RNA virosphere dsDNA virosphere or ecological niche marine virosphere ,-1
FC Kuressaare,FC Kuressaare commonly known as Kuressaare is an Estonian professional football club based in Kuressaare Saaremaa island The clubs home ground is Kuressaare linnastaadion Founded on 14 March 1997 the club competes in the Meistriliiga the top tier of Estonian football ,-1
Chana Blanksztejn,Chana Blanksztejn was a PolishJewish writer and journalist active in Vilna in the 1920s Known for her fight for womens suffrage she unsuccessfully ran in the 1922 Polish legislative election as a candidate of the Jewish Democratic Peoples Block Polish ydowski Demokratyczny Blok Ludowy of Folkspartei ,-1
Karapa mandal,Karapa mandal is one of the 21 mandals in Kakinada District of Andhra Pradesh As per census 2011 there are 19 villages ,-1
Mulepen Creek,Mulepen Creek is a stream in the US state of Georgia It is a tributary to the Ohoopee RiverMulepen Creek was named for a mule corral near its course The name sometimes is spelled out as Mule Pen Creek  References  ,-1
Clan Hope,Clan Hope is a Scottish clan of the Scottish Lowlands ,-1
1957 FA Charity Shield,The 1957 FA Charity Shield was the 35th FA Charity Shield an annual football match held between the winners of the previous seasons Football League and FA Cup competitions The match was contested by Manchester United who had won the 195657 Football League and Aston Villa who had won the 195657 FA Cup at Old Trafford Manchester on 22 October 1957 Manchester United won the match 40 with Tommy Taylor scoring a hattrick and Johnny Berry adding a penalty ,-1
Gerard George Fitzgerald,Gerard George Fitzgerald 10 October 1832  7 June 1904 was a 19thcentury Member of Parliament in New Zealand Like his brother James FitzGerald he was a journalist of considerable ability and cofounded The Southland Times in 1862 For the last 19 years of his life he was editor of The Timaru Herald ,-1
Semioptila,Semioptila is a genus of moths in the family Himantopteridae ,-1
Arado E.581-4,The Arado E5814 was a German flying wing bomber project It had three landing gears and an unusually low fuselage ,-1
Real Madrid (Puerto Rico),Real Madrid is a Puerto Rican soccer team established in 2009 Its home base is Bayamon Puerto Rico and they play at the Juan Ramon Loubriel Stadium and they will play in the Puerto Rico Soccer League in 2010 ,-1
"Kromy, Oryol Oblast",Kromy Russian  is an urban locality an urbantype settlement and the administrative center of Kromskoy District of Oryol Oblast Russia located on the Kroma River a tributary of the Oka 36 kilometers 22 mi southwest of Oryol Population 6733 2010 Census 7194 2002 Census 7082 1989 CensusIt was first chronicled in 1147 the same year as Moscow It was a seat of one of the Upper Oka Principalities of the 15th century In 1595 it was fortified by Boris Godunov in order to defend the Grand Duchy of Moscow from the Tatar raids During the Time of Troubles it gained nationwide renown as a major stronghold of the rebels such as the Don Cossacks led by Andrey Korela and Ivan Bolotnikovs generalsKromy was an important agricultural center throughout the 19th century A railway from Moscow to Kharkov reached it in the 1850s A large Neoclassical cathedral dates from this period Kromy was contested by Anton Denikins forces and the Red Army in October 1919Kromy lost its town status and was demoted to an urbantype settlement in 1924  References  ,-1
"1,1,1,2-Tetrachloroethane",1112Tetrachloroethane is a chlorinated hydrocarbon It is a colorless liquid with a sweet chloroformlike odor It is used as a solvent and in the production of wood stains and varnishes ,1
Ghada Shouaa,Ghada Shouaa Arabic   born September 10 1972 is a retired Syrian heptathlete At the 1996 Summer Olympics she won her countrys first and only Olympic gold medal She was also a World and Asian heptathlon champion She is considered one of the best Asian and Arab female athletes of all time She was a Syrian flag bearer at the opening ceremony of the 1996 Atlanta OlympicsShe has represented Syria in her two strongest multievent disciplines the individual high jump and long jump events She holds the Syrian high jump records with 187 m outdoors 1996 in javelin with 5482 m 1999 in 200 m with 2378 1996 in long jump with 677 1996 and in shot put with 1625 1999Shuaas heptathlon results include finishing 25th at the 1992 Barcelona Olympics 24th at the 1991 World Championships third at the 1999 World Athletics Championships and first at the 1994 Asian Games She is also multiple gold medalist at the Arab Athletics Championships With a performance of 6942 points at the HypoMeeting which moved her into the world alltime Top 25 and she went down in history as the best Asian and Arab heptathleteShouaas career coincided with those of older compatriot threetime Olympic champion and fourtime World champion legend Jackie JoynerKersee and Olympic champion Denise Lewis ,-1
List of Don't Be Tardy episodes,Dont Be Tardy is an American reality television series aired on Bravo that debuted on April 26 2012 as Dont Be Tardy For The Wedding It is a spinoff of The Real Housewives of Atlanta The series features Kim Zolciak her husband Kroy Biermann and her family The first season documented the couple as they prepared for their wedding as well as documenting the wedding day itself It was announced in November 2012 that the series had been renamed to its current title upon renewal Later seasons follow the daytoday lives of the ZolciakBiermann family As of October 6 2020 95 episodes of Dont Be Tardy have aired ,-1
Šumavské Hoštice,umavsk Hotice is a municipality and village in Prachatice District in the South Bohemian Region of the Czech Republic It has about 400 inhabitants umavsk Hotice lies approximately 10 kilometres 6 mi west of Prachatice 45 km 28 mi west of esk Budjovice and 123 km 76 mi south of Prague ,-1
Nydalens SK,Nydalens Skiklub is a Norwegian sports club from Nydalen Oslo It was founded in 1886 1886 and has sections for orienteering Nordic skiing and ski orienteering The club organized national ski jumping competitions regularly from 1891 to 1953 and had its own ski jumping venue at Korsvoll In orienteering the club won national championships in relay in 1954 men 1968 women 1996 1997 and 1999 men and 2000 and 2005 women The club organized the national orienteering championships in relay in 1953 the individual Norwegian championships in orienteering in 1961 and the national championships in 1999 Among the successful orienteers from the club are Bjrnar Valstad Astrid Hansen Elisabeth Ingvaldsen Marianne Andersen and Carl Henrik Bjrseth The club won the womens relay competition in Tiomila in 2006The club has around 500 members They hosted the 2012 Norwegian championships in orienteering in Maridalen  References  ,-1
François Pierre Barry,FranoisPierreBernard Barry 13 May 1813 Marseille  3 September 1905 SaintLaurentduVar was a French painter who specialized in maritime scenes ,-1
Aethes annosa,Aethes annosa is a species of moth of the family Tortricidae It is found in Peru  References  ,-1
Bobby Nardella,Robert Virgil Nardella III born April 22 1996 is an American professional ice hockey defenseman for HV71 in the Swedish Hockey League SHL ,-1
List of people with surname Cohen,This is an alphabetical list of people with surname Cohen or in a few cases a doublebarrelled surname that includes Cohen For variant spellings of this name see the pages for Cohn Kohn and Coen ,-1
Comox—Powell River,ComoxPowell River was a federal electoral district in British Columbia Canada that was represented in the House of Commons of Canada from 1979 to 1988 This riding was created in 1976 from parts of Coast Chilcotin ComoxAlberni and Skeena ridings It was abolished in 1987 when it was redistributed into ComoxAlberni and North IslandPowell River ridings It consisted of the Mount Waddington Regional District the Powell River Regional District except Lasqueti Island and the adjacent smaller islands the ComoxStrathcona Regional District the Central Coast Regional District the southern part of the KitimatStikine Regional District ie the part lying south of a line drawn from east to west along Finlayson Channel Sarah Passage Tolmie Channel Meyers Passage and Laredo Sound and the Sunshine Coast Regional District ,-1
Mario Moschi,Mario Moschi 6 May 1896  26 May 1971 was an Italian sculptor His work was part of the sculpture event in the art competition at the 1936 Summer Olympics ,-1
Krigia,Krigia is a genus of North American flowering plants in the family Asteraceae Plants of the genus are known generally as dwarf dandelions or dwarfdandelionsThe species vary in morphology They are annual or perennial herbs growing from a fibrous root system or a taproot One species has rhizomes with tubers The plants produce a single stem or up to 50 or more usually growing erect reaching a few centimeters to 75 centimeters tall Most of the leaves are basal but some stems have leaves higher up The blades are often linear to lanceshaped toothed or lobed and borne on winged petioles The flower heads are solitary growing at the top of the stem or on stalks from the leaf axils They contain up to 60 yellow or orange flowers The fruit is a hairless ribbed cypsela sometimes with a pappus SpeciesKrigia biflora  twoflower dwarfdandelion orange dwarfdandelion tall dwarfdandelion  most of eastern central  southwestern USA plus central Canada Krigia caroliniana Krigia cespitosa  weedy dwarfdandelion common dwarfdandelion oppositeleaved dwarfdandelion  southeastern  southcentral United States Krigia dandelion  potato dwarfdandelion colonial dwarfdandelion tuber dandelion  southeastern  southcentral United States Krigia integrifolia  Allegheny Mountains Krigia montana  mountain dwarfdandelion  southern Appalachians Krigia occidentalis  western dwarfdandelion  southcentral USA Krigia virginica  Virginia dwarfdandelion  eastern  southcentral United States Ontario British Columbia Krigia wrightii  Wrights dwarfdandelion  southcentral USA  References  ,-1
F. H. Maynard,Air Vice Marshal Forster Herbert Martin Sammy Maynard 1 May 1893  26 January 1976 was a senior commander in the Royal Air Force and a flying ace credited with six aerial victories during the First World War He also served as the Air Officer Commanding Malta during the early part of the Second World War His son Nigel Maynard also became an air marshal in the RAF ,-1
"Paisley Corners, Illinois",Paisley Corners is an unincorporated community in Bond County Illinois United States Paisley Corners is located on Illinois Route 127 northwest of Greenville  References  ,-1
Polypterus endlicheri,Polypterus endlicheri Heckel 1847 the saddled bichir is one of the largest species of the Polypterus genus of freshwater fish Named in honor of botanist Stephan Endlicher 18041849 who apparently discovered the species in the fish collection at the Naturhistorisches Museum Vienna ,-1
Adalberto García,Adalberto Batista Garcia born 31 August 1967 is a Brazilian longdistance runner He competed in the mens 5000 metres at the 1996 Summer Olympics ,-1
Craig Barrett (chief executive),Craig R Barrett born August 29 1939 is an American business executive who served as the chairman of the board of Intel Corporation until May 2009 He became CEO of Intel in 1998 a position he held for seven years After retiring from Intel Barrett joined the faculty at Thunderbird School of Global Management in Phoenix ,-1
Bi Hongyong,Bi Hongyong born 16 November 1974 is a retired Chinese high jumper He finished twelfth at the 1995 World Championships clearing only 215 metres 7 ft 1 in after jumping 227 m 7 ft 5 in in the qualification round He won the Asian Junior Championships in 1992 He is a twotime national champion for PR China in the mens high jump event ,-1
Sellerio Editore,Sellerio Editore is an Italian publisher founded in 1969 in Palermo by Elvira Giorgianni and her husband Enzo Sellerio encouraged by the writer Leonardo Sciascia and the anthropologist Antonino Buttitta ,-1
