title,summary,category
Alikulular,Alikulular is a village in the Aghjabadi Rayon of Azerbaijan It is suspected that this village has undergone a name change or no longer exists as no Azerbaijani website mentions it under this name ,-1
STUFT,A STUFT acronym for ship taken up from trade is a UK civilian ship requisitioned for government use The Falklands War of 1982 saw a diversity of ships taken up from trade including tankers with potable water see British logistics in the Falklands War and fuels freighters carrying food and munitions and luxury liners converted to carry troops ,-1
Francesco Marchetti Selvaggiani,Francesco Marchetti Selvaggiani 1 October 1871  13 January 1951 was an Italian cardinal of the Catholic Church who served as Secretary of the Congregation for the Propagation of the Faith Vicar General of His Holiness Secretary of the Holy Office and Dean of the College of Cardinals He was elevated to the cardinalate in 1930 ,-1
John McAdorey,John McAdorey 16 September 1974  25 September 2019 was an Irish sprinter He competed in the mens 4  100 metres relay at the 2000 Summer Olympics ,-1
WJMK (group),WJMK Korean  short for Wuju Meki was a fourmember special project unit group between Cosmic Girls and Weki Meki created by Starship Entertainment and Fantagio Music It is composed of four members Seola Luda Yoojung and Doyeon ,-1
Eric Mensik,Eric Mensik born December 18 1987 is a former American football offensive tackle He was signed by the Arizona Cardinals as an undrafted free agent in 2011 He played college football at Oklahoma from 2007 to 2010 beginning as a tight end and later moving to the offensive line He was selected as a firstteam AllBig 12 player after the 2010 college football season Mensik was signed by the Arizona Cardinals as an undrafted free agent following the end of the NFL lockout in 2011 He was waived on August 29 2011 ,-1
Pace Yourself,Pace Yourself is an album by saxophonist Tim Bernes Caos Totale which was recorded in 1990 and released on the JMT label ,-1
Samurai Warriors 2,Samurai Warriors 2 2 Sengoku Musou 2 in Japan is a sequel to the original Samurai Warriors created by Koei and Omega Force The game was released in 2006 for the PlayStation 2 and Xbox 360 and ported to Microsoft Windows in 2008 Like the Dynasty Warriors series an Empires expansion was released as well and an Xtreme Legends expansion followed on August 23 2007 in Japan The game alongside its two expansions Xtreme Legends and Empires also receive a HDenhanced port for PlayStation 3 and PlayStation Vita under the name Sengoku Musou 2 with Moushouden  Empires HD Version Samurai Warriors 3 the sequel to Samurai Warriors 2 and the third game in the series was released in December 2009 for the Wii ,-1
Come Dine with Me New Zealand,Come Dine with Me New Zealand was a New Zealand television reality programme based on the UKs Come Dine with Me Narrated by comedian Guy Williams it premiered on TV3 on 15 June 2015 with the final episode airing on 7 August 2015 Originally planned to air in the late afternoon it aired at 7730 pm each weeknight from two weeks after the discontinuation of 3 News former current affairs show Campbell Live until the launch of Story its new current affairs show In November 2015 MediaWorks decided not to renew the series ,-1
Athletics at the 2008 Summer Paralympics – Women's 100 metres T38,The Womens 100m T38 had its competition held on September 9 with the First Round at 1050 and the Final at 1800 ,-1
Thiruvonam (film),Thiruvonam is a 1975 Indian Malayalamlanguage film directed by Sreekumaran Thampi and produced by K P Mohanan The film stars Prem Nazir Sharada Kamal Haasan and Jayasudha The film has musical score by R K Shekhar and songs composed by M K Arjunan ,-1
David Leavitt,David Leavitt  born June 23 1961 is an American novelist short story writer and biographer ,-1
Verification condition generator,A verification condition generator is a common subcomponent of an automated program verifier that synthesizes formal verification conditions by analyzing a programs source code using a method based upon Hoare logic VC generators may require that the source code contains logical annotations provided by the programmer or the compiler such as prepostconditions and loop invariants a form of proofcarrying code VC generators are often coupled with SMT solvers in the backend of a program verifier After a verification condition generator has created the verification conditions they are passed to an automated theorem prover which can then formally prove the correctness of the code Methods have been proposed to use the operational semantics of machine languages to automatically generate verification condition generators  References  ,-1
Victoria Sigler,Victoria S Sigler born 1951 is a judge of the MiamiDade County Circuit Court She was the first openly gay circuit judge in Florida ,-1
Kapuzinerberg,Kapuzinerberg is a hill on the eastern bank of the Salzach river in the city of Salzburg in Austria which rises to an elevation of 640 metres 2100 ft It is located to the south of Salzburgs historic city centre and forms part of the citys UNESCO World Heritage Site ,-1
24 Japan,24 Japan  Tuentif Japan stylized as 24 JAPAN is a Japanese action thriller television series airing on TV Asahi based on the American series 24 It began airing from 9 October 2020 and continued through March 2021 It was created by Joel Surnow and Robert Cochran written by Shkei Nagasaka and produced by Total Media Communication and 20th Century Fox Television also commemorates the 60th anniversary of TV Asahi The series focuses on Genba Shid who works for the Tokyobased Counter Terrorist Unit his family and a plot to assassinate Urara Asakura who is set to become the first female prime minister of Japan Some viewers found that in general the plot of 24 Japan moves more slowly than the fastpaced original seriesThe Japanese version of 24 is the second adaptation of the show following the Hindilanguage adaptation of the show 24 Japan follows a story line similar to the first season of the American series but with uptodate technology ,-1
Eremiaphila laeviceps,Eremiaphila laeviceps is a species of praying mantis in the family Eremiaphilidae ,-1
Stainby,Stainby is a village and former civil parish now in the parish of Gunby and Stainby in the South Kesteven district of Lincolnshire England It is situated 2 miles 32 km west from the A1 road 15 miles 24 km east from the Viking Way and the Leicestershire border and 8 miles 13 km south from Grantham In 1921 the parish had a population of 117 Stainby is nominally in the civil parish of Gunby and Stainby although the parish is now administered as part of the Colsterworth district parishes Stainby had been a parish in its own right until 1931 Adjacent villages include Buckminster North Witham Colsterworth Gunby Sewstern and Skillington Stainby is on the B676 road which runs between Melton Mowbray Buckminster Road and Colsterworth Colsterworth Road The road is frequented by heavy goods vehicles from the nearby industrial estate at Sewstern and by vehicles heading from the Midlands towards East Anglia an alternative route is through Wymondham and South WithamThere are no shops or public houses  the nearest are in Colsterworth The church on Main Road is dedicated to St Peter The former Stainby quarry is an event venue for vehicle offroading ,-1
Troubletown,Troubletown was a syndicated weekly comic strip by American cartoonist Lloyd Dangle Begun in 1988 it ran in many alternative weeklies including The Stranger The Portland Mercury and The Austin Chronicle It also appeared in The Progressive magazine Most strips involved political satire from a liberal perspective Several book collections of Troubletown have been published It is also featured in the anthology Attitude The New Subversive CartoonistsDangle retired his Troubletown strip at the end of April 2011 ,-1
Gisbert Zarambaud,GisbertTristan Zarambaud born 8 July 1997 is a Central African professional footballer who plays as a leftback for FC Vesoul and the Central African Republic national team ,-1
The Art of Mathematics,The Art of Mathematics Korean   romanized suhakui jeongseok written by Hong SungDae Korean  is a series of mathematics textbooks for high school students in South Korea First published in 1966 it is the bestselling book series in South Korea with about 46 million copies sold as of 2016 In Jeongeup North Jeolla Province the hometown of Hong SungDae a street is named Suhakjeongseokgil Korean  in honor of the author ,-1
"Galway (village), New York",Galway is a village in the town of Galway in Saratoga County New York United States The population was 200 at the 2010 census The village is north of Schenectady Galway Lake a vacation area is west of the village ,-1
Edward Devine,Edward Devine 10 August 1833  18 December 1908 was a New Zealand coach driver hotelkeeper and barman He was born in Brighton Tasmania Australia on 10 August 1833 He won a high reputation for excellent handling of horses and for his skill in emergencies He began driving for Cobb  Co in New Zealand in 1863 When the rail link between Christchurch and Dunedin was finished in 1878 he tried a new route but retired after a few weeks A stint as a hotel proprietor ended when his licence was not renewed and he became a barman in DunedinBy 1894 he had returned to Australia He died in Ballarat in 1908  References  ,-1
Heterocompsa stellae,Heterocompsa stellae is a species of beetle in the family Cerambycidae It was described by Martins in 1962  References  ,-1
Del Rey League,The Del Rey League is a high school athletic conference that is part of the CIF Southern Section Members are mostly private parochial schools in the South Bay affiliated the Roman Catholic Archdiocese of Los Angeles ,-1
Deconstruction Tour,Deconstruction Tour was a oneday punk music and skate festival that was staged in various countries across Europe It first took place in 1999 and occurred annually until 2006 The tour was arranged by Destiny Tourbooking In general the tour offered the opening slot of each day to a local often unsigned band with the following acts increasing in notability throughout the lineup The festival also included displays by BMX riders and skaters Aside from the first year 2006 was possibly the least successful for the tour due to problems with booking bands and the limited number of dates that were booked The tour has not gone ahead since 2006 ,-1
Constitution of Venezuela (1961),The Constitution of Venezuela of 1961 was approved on January 16 1961 by the then Congress of the Republic currently the National Assembly with the affirmative vote of the four main political forces of the country at that time Democratic Action Democratic Republican Union COPEI and the Communist Party of Venezuela It came into force on January 23 of the same year in commemoration of the return to democracy in Venezuela on January 23 1958 In December 1999 this text was repealed when the 1999 Constitution was approved by popular vote This Constitution was based on the principles of the 1947 Constitution that had been repealed in 1953 by the dictatorship of Marcos Prez Jimnez ,-1
Pelican Lake Indian Residential School,The Pelican Lake Indian Residential Schoolalso known as Pelican Falls Indian Residential School and Sioux Lookout Indian Residential Schoolwas a Canadian Indian Residential School in Sioux Lookout Ontario that operated from 1929 through 1969 While it was in operation the school took Ojibway and Cree students from both Treaty Three and Treaty Nine territories in northern Ontario and eastern Manitoba A former student of the school reported that students experienced physical psychological and sexual abuse while attending ,-1
Halgerda punctata,Halgerda punctata is a species of sea slug a dorid nudibranch shellless marine gastropod mollusks in the family Discodorididae ,-1
Dalailama bifurca,Dalailama bifurca is a moth in the Endromidae family It was described by Staudinger in 1896 It was described from Kuku Noor ,-1
Labeobarbus cardozoi,Labeobarbus cardozoi is a species of cyprinid fish found in the Congo Democratic Republic and Angola in Africa ,-1
John Gregg (loyalist),John Gregg 1957  1 February 2003 was a senior member of the UDAUFF loyalist paramilitary organisation in Northern Ireland In 1984 Gregg seriously wounded Sinn Fin president Gerry Adams in an assassination attempt From the 1990s until he was shot dead in 2003 by rival associates Gregg served as brigadier of the UDAs South East Antrim Brigade Widely known as a man with a fearsome reputation Gregg was considered a hawk in some loyalist circles ,-1
Lisa Brennan-Jobs,Lisa Nicole BrennanJobs ne Brennan born May 17 1978 is an American writer She is the daughter of Apple cofounder Steve Jobs and Chrisann Brennan Jobs initially denied paternity for several years which led to a legal case and various media reports in the early days of Apple Lisa and Steve Jobs eventually reconciled and he accepted his paternity BrennanJobs later worked as a journalist and magazine writer An early Apple business computer the Apple Lisa is named after her and she has been depicted in a number of biographies and films including the biopics Pirates of Silicon Valley 1999 Jobs 2013 and Steve Jobs 2015 A fictionalized version of BrennanJobs is a major character in her aunt Mona Simpsons novel A Regular Guy ,-1
Litsa Diamanti,Litsa Diamanti Greek   born Evangelia EvangelitsaLitsa Kosmidou 1949 in Kolonos Athens is a Greek lako singer who became famous in the 1960s and 1970s She has been described as the childwonder of the Sixties decade and the absolute diva of metapolitefsi Her hits have been described as alltime classics ,-1
Melbourne Cinematheque,The Melbourne Cinmathque is a nonprofit film society screening programmes yearround dedicated to presenting the history of world cinema on the big screen in carefully curated retrospectives It started out as Melbourne University Film Society MUFS in 1948 and changed its name to Cinmathque in 1984 It screens at the Australian Centre for the Moving Image ACMI The Melbourne Cinmathque screens archival 35mm and 16mm film prints from organisations such as the British Film Institute Library of Congress Washington USA UCLA Film  TV Archive etc The Melbourne Cinmathques mission is to present films in the medium they were created and as closely as possible to screen them the way they would have originally screened ie big screen 16  35mm prints not video or DVD Programmes include a diverse selection of classic and contemporary films showcasing director retrospectives special guest appearances and thematic series including archival material and many new prints Seasons have included A Band of Outsiders The Cinematic Underworld of JeanPierre Melville All Art is One The Visionary Cinema of Michael Powell and Emeric Pressburger Life is Art The World of Jean Renoir Glacial Crossroads The Cinema of Michael Haneke Surviving Kane Around the World with Orson Welles and The Music of Time The World of Max Ophls as well as programmes dedicated to German Noir Yasujir Ozu Marco Bellocchio Agns Varda Manoel de Oliveira and Barbara Stanwyck amongst others The Melbourne Cinmathque is selfadministered nonprofit membershipdriven and relies on support from individuals foundations corporations and government funding to maintain its high standard of excellence ,-1
Swintonia floribunda,Swintonia floribunda is a tree species in the family Anacardiaceae It can be found in the Andaman Islands IndoChina and Malesia through to Sumatra The Catalogue of Life lists one subspecies S floribunda var penangiana King KM Kochummen which is found in peninsular Malaysia  References  ,-1
Cágado River (Minas Gerais),The Cgado River is a river of Minas Gerais state in southeastern Brazil It rises in Chcara in the Serra da Mantiqueira and flows 101 kilometres 63 mi to its mouth on the Paraibuna between Santana do Deserto and Chiador ,-1
Kazusuke Ogawa,Kazusuke Ogawa  Ogawa Kazusuke 29 April 1930  20 September 2014 was a Japanese literary critic Ogawa was born in Tokyo and graduated from Meiji Universitys Literature Department in 1951 Having Shinichir Nakamura as his mentor he began writing poetry and literary criticism and after a stint as a high school teacher in Tochigi Prefecture he became an assistant professor at Showa Womens University After retiring he also worked as a lecturer at his alma mater and at Tokyo Denki University After 1990 many of his writings centered on cherry blossoms He died on 20 September 2014 of stomach cancer ,-1
Archie Urciuoli,J Arthur Archie Urciuoli is a business executive attorney author and a veteran racing driver whose sports car racing career spans five decades ,-1
Vladimir Yeryomin (actor),Vladimir Arkadyevich Yeryomin Russian    born September 6 1950 is a Soviet and Russian stage film and voice actor screenwriter producer and television presenter Merited Artist of the Russian Federation 2006 ,-1
Huayllo District,Huayllo District is one of the seventeen districts of the province Aymaraes in Peru ,-1
Manoj Michigan,Manoj Michigan is an Indian film director screenwriter and producer for Bengali cinema His notable works include films I Reborn 2019 Tritiya Adhyay 2019 Aami Joy Chatterjee 2018 Damadol 2013 Hello Kolkata 2008 He was the producer of psychological thriller film 89 2015 ,-1
Callidrepana jianfenglingensis,Callidrepana jianfenglingensis is a moth in the family Drepanidae first described by Y Li Y Hu and M Wang in 2014 It is found in Hainan China  References  ,-1
Max Warren,Max Warren born 29 January 1993 is a former professional Australian rules footballer who played for the North Melbourne Football Club in the Australian Football League AFL Warren was drafted with the 10th selection in the 2012 rookie draft from Eastern Ranges in the TAC Cup Warren made his debut in Round 15 2014 against Brisbane LionsWarren was delisted at the conclusion of the 2014 AFL season after a disappointing three years with the North Melbourne Football Club during which Warren only played one game for the club He was redrafted in the 2015 rookie draft However after failing to play a match in 2015 he was delisted again at the conclusion of the 2015 seasonWarren is now a Melbourne based real estate agent ,-1
Take It on the Run,Take It on the Run is a song by American rock band REO Speedwagon off the bands ninth studio album Hi Infidelity 1980 The song was written by lead guitarist Gary Richrath Take It on the Run was the followup single behind the groups numberone hit Keep on Loving You The single went gold on April 17 1989 Take It on the Run has appeared on dozens of various artists compilation albums as well as several REO Speedwagon greatesthits albums The 2017 song Messin Around by Pitbull featuring Enrique Iglesias interpolates Take It on the Run ,-1
Hydroginella rugosa,Hydroginella rugosa is a species of sea snail a marine gastropod mollusc in the family Marginellidae the margin snails ,-1
Purdown BT Tower,Purdown BT Tower also known as Purdown Transmitter sometimes written as Pur Down is a 701 metres 230 ft tall telecommunications tower in Bristol England Built in 1970 for the British Telecom microwave network it is now used to transmit radio and provide mobile phone coverage The tower is located on a hill Purdown in Stoke Park in the Lockleaze suburb about 2 miles 32 km north of the city centre It is a prominent landmark visible from many areas of the city and from major transport routes on the approach to the city including the M32 motorway and Filton Bank railway The tower is recorded as a Valued Landmark by Bristol City Council and it has been featured in locallyproduced media such as the opening sequence of TV series Skins 2008 It is one of fourteen reinforced concrete towers owned by BT in the UK ,-1
Flore des Serres et des Jardins de l'Europe,Flore des Serres et des Jardins de lEurope French for Flowers of the Greenhouses and Gardens of Europe 18451888 was one of the finest horticulture journals produced in Europe during the 19th century spanning 23 volumes and over 2000 coloured plates with French German and English text Founded by Louis van Houtte and edited together with Charles Antoine Lemaire and Michael Joseph Franois Scheidweiler it was a showcase for lavish handfinished engravings and lithographs depicting and describing botanical curiosities and treasures from around the world The work is remarkable for the level of colourprinting craftmanship displayed by the Belgian lithographers Guillaume Severeyns LouisConstantin Stroobant and Pieter De Pannemaker Stroobant printed many of the illustrations for the first 10 volumes Most of the plants depicted in Flore des Serres were available for sale in van Houttes nursery so that in a sense the journal doubled as a catalogue The editors were experienced botanical engravers and horticulturists combining their knowledge and skills to create a showpiece of novel exotics and familiar cultivated plants Lemaire came from being an engraver for PierreJoseph Redouts great works Les Liliaces and Les Roses Van Houtte owner of the most successful nursery in Europe at that time sent his own plant explorers to find unknown orchids and other exotics and bring them back to Ghent for cultivation at his nursery and later publication in Flore des Serres ,-1
Kinnock,Kinnock is a surname of Scottish origin ,-1
The Laundress (Greuze),The Laundress French La Blanchisseuse is a 1761 genre painting by French artist JeanBaptiste Greuze 17251805 existing in two versions The subject of laundresses also known as washerwomen was a popular one in art especially in FranceThe prime version of The Laundress was one of fourteen works exhibited by Greuze at the Salon of 1761 and was part of the collection of Greuzes patron Ange Laurent Lalive de Jully The painting was mostly unknown for more than two centuries as it was purchased in 1770 by Gustaf Adolf Sparre and privately held in that Swedish art collection and rarely seen until it was acquired by the Getty Museum in 1983The second version is now in the Fogg Museum Harvard At 39 x 31 cm it is just slightly smaller than the Gettys and also dated c 1761 It was possibly created to allow a print to be made of the subject ,-1
Stewart Fraser (footballer),James Stewart Fraser born 1936 in Aberdeen is a Scottish former footballer who played as a left half Fraser spent his entire senior career with Dundee United making nearly 200 appearances in a tenyear spell before a broken leg halted his United career He represented the Scottish Football League XI twice in 1962 scoring a hattrick against the League of Ireland XI in an 110 winWhen he left Dundee United Fraser signed as player manager with Brora Rangers FC in the Scottish Highland Football League where he remained for several seasons  References  ,-1
Sven Ohlsson (wrestler),Sven Ohlsson 25 February 1886  27 April 1961 was a Swedish wrestler He competed at the 1912 Summer Olympics and the 1920 Summer OlympicsSven Ohlsson represented Djurgrdens IF and Brandkrens IK ,-1
Viking Range,Viking Range Corporation is an American appliance company that manufactures kitchen appliances for residential and commercial use and is not to be confused with the house brand of appliances from the Canadian department store Eatons which went bankrupt in 1999 and which also used the name Viking Viking originated the professional segment of kitchen appliances with its introduction of the first professionalgrade range for home use in 1987 Today the company offers three complete lines of premium appliances including cooking ventilation kitchen cleanup and refrigeration as well as various outdoor appliances In addition to their Professional and less expensive Designer series Vikings latest offering is their new Commercial line of kitchen appliances for use in restaurant and other commercial kitchens Headquartered on historic Cotton Row in downtown Greenwood Mississippi Viking Range employs more than 1000 people at four manufacturing facilities in Leflore County In 2013 the Middleby Corporation acquired Viking Range Corporation for 380 million in cash Within a couple of months of the acquisition the company laid off onefifth of its employees ,-1
On a Sensual Note,On a Sensual Note OASN is the first collegiate a cappella singing ensemble of American University welcome to maleidentifying individuals as well as nonbinary folk Founded in the fall of 1996 OASN is the universitys oldest a cappella ensemble The ensemble performs regularly at campus events tours and visits other schools and participates in regional festivals OASNs most popular events include its biannual endofsemester concerts in the Kay Spiritual Life Center a tradition which has been mirrored by newer performing ensembles OASN is the only collegiate a cappella group at American University to go on a Spring Break Tour to a specific destination commonly on the East Coast recent destinations include New Orleans LA Miami FL Savannah GA and Charlotte NC ,-1
Steele Canyon High School,Steele Canyon Charter High School is a public charter high school located in the San Diego East County community of Spring Valley California United States Opened in 2000 the school serves students in grades nine through grade twelve It has operated as a California charter school since July 1 2007 Steele Canyons main rival is Valhalla High School Steele Canyon served as an evacuation center for San Diego residents threatened by the Harris fire one of the larger October 2007 California wildfires ,-1
