title,summary,category
Gunpowder Milkshake,Gunpowder Milkshake is a 2021 action thriller film directed by Navot Papushado who cowrote the screenplay with Ehud Lavski Employing both pulpfiction genre dark comedy and strong feminist undertones the film stars Karen Gillan as a young hitwoman who must team up with her estranged mother Lena Headey and her former colleagues Carla Gugino Michelle Yeoh and Angela Bassett in order to save a young girl Chloe Coleman from rival assassins sent by the grieving father of a man she killed on orders from the head of the HR department of The Firm Nathan Paul Giamatti The films production was announced at the American Film Market in 2018 Casting announcements were made throughout 2019 starting with Gillan in January and principal photography took place from June to August 2019 in Berlin It is a coproduction between The Picture Company Babelsberg Studio and StudioCanals German branch with the participation of French television channels Canal and Cin Gunpowder Milkshake was released in the United States on July 14 2021 by Netflix with a simultaneous limited theatrical release It was released theatrically by StudioCanal in France on July 21 and in Germany on December 2 2021 The film received mixed reviews from critics A sequel is in development ,-1
Gunhild Emanuelsen,Gunhild Emanuelsen 31 December 1914  19 October 2006 was a Norwegian pacifist womens rights activist trade unionist and politician An active member of the Norsk Kvinneforbund Norwegian Womens Association she represented Norway in international womens conferences In the 1990s she was a leading member of Norways Nei til atomvpen which sought to abolish nuclear weapons ,-1
De Immigrant,De Immigrant is a windmill located in Fulton Illinois built on a flood control dike on the Mississippi River The City of Fulton contracted Molema Millbuilders Havenga Construction and Lowlands Management on December 4 1998 to construct a Dutch windmill to be fabricated by native millwrights in the Netherlands and shipped to Fulton for assembly Two months later construction began with thirty metric tons of wood The construction took place in phases and the tower cap sails and machinery were all put together on November 19 1999 On May 5 2001 De Immigrant officially began grinding wheat buckwheat rye and cornmeal ,-1
Allgaier,Allgaier is a surname Notable people with the surname include Justin Allgaier born 1986 American stock car racer Johann Baptist Allgaier 17631823 Austrian chess master ,-1
Be Right Back,Be Right Back is the first episode of the second series of British science fiction anthology series Black Mirror It was written by series creator and showrunner Charlie Brooker directed by Owen Harris and first aired on Channel 4 on 11 February 2013 The episode tells the story of Martha Hayley Atwell a young woman whose boyfriend Ash Starmer Domhnall Gleeson is killed in a car accident As she mourns him she discovers that technology now allows her to communicate with an artificial intelligence imitating Ash and reluctantly decides to try it Be Right Back had two sources of inspiration the question of whether to delete a dead friends phone number from ones contacts and the idea that Twitter posts could be made by software mimicking dead people Be Right Back explores the theme of grief and tells a melancholy story similar to the previous episode The Entire History of You The episode received highly positive reviews with the performances of Atwell and Gleeson receiving universal acclaim Some hailed it as the best episode of Black Mirror though the ending divided critics Several reallife artificial intelligence products have been compared to the one shown in the episode including a Luka chatbot that was partially inspired by the episode and a planned Amazon Alexa feature designed to imitate dead loved ones ,-1
Marcial Arbiza,Marcial Arbiza Arruti 8 July 1914  11 August 1992 was a Spanish industrial engineer and footballer who played as a forward for Real Unin Real Madrid and Real Sociedad ,-1
Jack Powell (1913 pitcher),Reginald Bertrand Jack Powell August 17 1891  March 12 1930 was a Major League Baseball pitcher who played for the St Louis Browns in 1913 He appeared in two games and pitched an inning in each allowing three runs none earned one hit and two walks Powell choked to death in 1930 when he was 38 after attempting to swallow one half of a steak in a Memphis cafe ,-1
"Back Cove, Fogo, Newfoundland and Labrador",Back Cove is a small fishing village on Fogo Island in the Fogo District This place is separated from Fogo by a small neck of land It had a population of 59 in 1956 ,-1
Gorakhpur–Amritsar Jan Sadharan Express,The 22423  22424 GorakhpurAmritsar Jan Sadharan Express is an Express train belonging to Northern Railway zone that runs between Gorakhpur Junction and Amritsar Junction in India It is currently being operated with 2242322424 train numbers on a weekly basis ,-1
Boy with a Dog,Boy with a Dog is a 16551660 oil on canvas painting by Bartolom Esteban Murillo now in the Hermitage Museum in Saint Petersburg for which it was acquired from the Comte de Choiseul collection in 1772The painting represents a ragged mischievous and cheerful boy playing with a dog and which is the thematic model of many paintings by Murillo children victims of the hardship that in the midseventeenth century affected a Seville drowned by the taxes and the competition of Cdiz after the plague of 1649  References  ,-1
Mittermeier's Tapajós saki,Mittermeiers Tapajs saki Pithecia mittermeieri is a disputed species of saki monkey a type of New World monkey It is endemic to westcentral Brazil ,-1
Willot Hall,Willot Hall is a country house in the parish of Prestbury some 45 km to the east of Wilmslow Cheshire England It originated as a medieval hall house in the later part of the 15th century This was encased in stone in the 17th century Later in the century a service wing was added The house was restored and extended between 1933 and 1939 moving the entrance and reopening the great hall to the roof It is constructed partly in buff sandstone rubble and partly in brick with Kerridge stone slate roofs It is in 2 storeys with a fourbay entrance front the left bay being larger than the others The left bay contains mullioned windows and is gabled The other bays contain a doorway smaller mullioned windows and gabled dormers The house is recorded in the National Heritage List for England as a designated Grade II listed building ,-1
Muscle Shoals SmasHers,The Muscle Shoals SmasHers were a fullcontact womens outdoor football team of the National Womens Football Association The team officially became part of the NWFA and began playing league games in 2004 Home games for the SmasHers were played at the Colbert County High School football stadium in Muscle Shoals Alabama ,-1
Red Gendron,Dennis Red Gendron November 27 1957  April 9 2021 was an ice hockey coach most recently for the University of Maine mens ice hockey team Gendron previously served as head coach for the Albany River Rats and Indiana Ice and held multiple positions for the New Jersey Devils Albany River Rats University of Maine University of Massachusetts Yale University and Team USA ,-1
Orakzai Scouts,The Orakzai Scouts is a paramilitary regiment forming part of the Frontier Corps Khyber Pakhtunkhwa North in Pakistan The name alludes to the Orakzai tribe and the Orakzai Agency now a district in Khyber Pakhtunkhwa province The regiment had a 202021 budget of Rs 183 billion and is composed of a headquarters wing with six battalionsized manoeuvre wings and a special operations group ,-1
St. Louis Community College–Meramec,St Louis Community CollegeMeramec also known as STLCCMeramec or Meramec campus is located in the suburb of Kirkwood Missouri Meramec is the largest community college in Missouri with over 12000 undergraduate and transfer students Along with the 78acre 316 ha main campus in Kirkwood Meramec operates one satellite campus in South St Louis County  Meramecs South County Education and University Center The college is named after the Meramec River that meanders through central Missouri before emptying into the Mississippi River at the border between St Louis and Jefferson Counties ,-1
Cavan GAA honours,This is a list of Gaelic Athletic Association athletes and teams who have won honours for Cavan GAA ,-1
Gåbense Færgegård,Gbense Frgegrd Gbense Ferry Inn is a historic building in the village of Gbense on the north coast of Falster in southeastern Denmark ,-1
Jere Kallinen,Jere Kallinen born 10 January 2002 is a Finnish professional football player He plays as a defensive midfielder for Veikkausliiga club AC Oulu and Finland U21 national team ,-1
"Hutchinson, Kansas",Hutchinson is the largest city and county seat in Reno County Kansas United States and located on the Arkansas River It has been home to salt mines since 1887 thus its nickname of Salt City but locals call it Hutch As of the 2020 census the population of the city was 40006Each year Hutchinson hosts the Kansas State Fair and National Junior College Athletic Association NJCAA Basketball Tournament It is the home of the Hutchinson Community College the Cosmosphere aerospace museum and Strataca underground salt museum ,-1
Simon Mbatshi Batshia,Simon Mbatshi Batshia born 24 May 1949 is a politician from the Democratic Republic of the Congo He was the Governor of BasCongo province from February 2007 to March 2012 when he was elected as a deputy to the National Assembly Batshia is also a consultant in conflict resolution at the Centre for Conflict Resolution based in Cape Town South Africa and is a member of the South African Institute for International Affairs In 2007 Batshia ordered the opening of the border between the Democratic Republic of the Congo and the neighboring Republic of the Congo at Luozi which had been closed for ten years to increase trade among people living near the border ,-1
Gujarat Cancer Research Institute,Gujarat Cancer Research Institute GCRI is a state owned cancer research institute in Gujarat India It was established in 1972 It is one of the 25 government funded Regional Cancer Centres in India  References  ,-1
1922 United States elections,The 1922 United States elections were held on November 7 1922 The election took place during Republican President Warren G Hardings term The Republican Party lost seats in both chambers of Congress but retained their majority in the House and Senate In the House the Republicans lost seventyseven seats to the Democratic Party The Republicans also lost seven seats in the US Senate six to the Democrats and one to the Minnesota FarmerLabor PartyThe election is notable in that no redistricting occurred despite the completion of the 1920 United States Census as Congress failed to pass a redistricting bill This is the only congressional election in which there was no redistricting after a census The Apportionment Act of 1911 remained in effect until the Reapportionment Act of 1929 The election was a victory for Hardings progressive opponents in the Republican Party and helped lead to the Teapot Dome investigations and Robert M La Follettes 1924 third party candidacy ,-1
Ensch,Ensch is a municipality in the TrierSaarburg district in RhinelandPalatinate Germany  References  ,-1
Rob Stone (sportscaster),Rob Stone born April 15 1969 is a sports commentator for Fox Sports covering various sports including Major League Soccer MLS NCAA and NFL football and the Professional Bowlers Association PBA Stone previously covered sports for ESPN A WWE fan Stone briefly won the WWE 247 Championship during a Fox promotional event becoming the first nonWWE Superstar to win the championship ,-1
Wamanripa (San Mateo),Wamanripa local name for Senecio or a species of it also applied for Laccopetalum giganteum Hispanicized spelling Huamanripa is a 5110metrehigh 16765 ft mountain in the Paryaqaqa mountain range in the Andes of Peru It is situated in the Lima Region Huarochir Province San Mateo District Wamanripa lies northwest of Phaqcha and Uqsha Wallqa and northeast of Waqaypaka  References  ,-1
Sam Jordan's Bar,Sam Jordans Bar is a historic building and a former workingclass neighborhood bar open from 1959 to 2019 located at 40044006 3rd Street in the Bayview neighborhood of San Francisco California US It is a San Francisco Designated Landmark number 263 since February 6 2013 It also went by the name Sam Jordans Bar and Grill ,-1
Steve Wright (serial killer),Steven Gerald James Wright born 24 April 1958 is an English serial killer also known as the Suffolk Strangler He is serving a wholelife term in prison for the murder of five women who worked in Ipswich Suffolk The killings took place during the final months of 2006 and Wright was found guilty in February 2008 ,-1
Paulo Garcia (New Zealand politician),Paulo Reyes Garcia is a New Zealand politician and former Member of Parliament in the House of Representatives for the New Zealand National Party ,-1
Glyceraldehyde-3-phosphate dehydrogenase (NAD(P)+),In enzymology a glyceraldehyde3phosphate dehydrogenase NADP EC 12159 is an enzyme that catalyzes the chemical reaction Dglyceraldehyde 3phosphate  phosphate  NADP  displaystyle rightleftharpoons  3phosphoDglyceroyl phosphate  NADPH  HThe 4 substrates of this enzyme are Dglyceraldehyde 3phosphate phosphate NAD and NADP whereas its 4 products are 3phosphoDglyceroyl phosphate NADH NADPH and H This enzyme belongs to the family of oxidoreductases specifically those acting on the aldehyde or oxo group of donor with NAD or NADP as acceptor The systematic name of this enzyme class is Dglyceraldehyde 3phosphateNADP oxidoreductase phosphorylating Other names in common use include phosphorylating triosephosphate dehydrogenase NADP and glyceraldehyde3phosphate dehydrogenase NADP phosphorylating ,-1
John Samuel Phene,John Samuel Phene FRGS FSA FRIBA 1822  11 March 1912 was a British architect who lived in Chelsea London for more than 50 years ,-1
Polar bear jail,The polar bear jail officially known as the Polar Bear Holding Facility is a special building in Churchill Manitoba Canada where polar bears that are considered troublesome or dangerous are isolated before they can be relocatedBefore the facility was established polar bears which were considered dangerous were shot The jail was established in 1982 according to other sources in 1983 after a person was mauled by a bear on the street in the building officially named House D20 a former military morgue The facility is the subject of the poem Churchill Bear Jail by Salish Chief Victor A Charlo ,-1
Bill Bonham,William Gordon Bonham born October 1 1948 is a retired former pitcher for the Chicago Cubs 197177 and Cincinnati Reds 197880 He played for the UCLA Bruins and was a member of the 1969 College World Series team with Chris Chambliss He helped the Reds win the 1979 National League Western Division Bonham led the National League in losses 22 in 1974 On July 31 1974 Bonham tied a Major League record shared by 49 pitchers by striking out four batters in an inning 2nd He also led the National League in earned runs allowed 120 in 1975 In 10 years he had a 7583 winloss record and had 300 games 214 games started 27 complete games 4 shutouts 33 games finished 11 saves 148713 innings pitched 1512 hits allowed 743 runs allowed 662 earned runs allowed 98 home runs allowed 636 walks allowed 985 strikeouts 35 hit batsmen 68 wild pitches 6484 batters faced 57 intentional walks 19 balks and a 401 ERA ,-1
Halfaya Field,Halfaya Field is an oil field located east of Amarah Iraq Halfaya is proven to hold 41 billion barrels 650000000 m3 of recoverable reserve and has production potential of 200000535000 barrels per day 3180085100 m3d the China National Petroleum Corporationled group finished the first phase in June 2012 and increased production from 3000 barrels per day 480 m3d to 100000 barrels per day 16000 m3d 15 months ahead of schedule CNPC has started preliminary work on the second phase of Halfaya which will bring the capacity to 200000 bpdIn December 2009 the China National Petroleum Corporation was awarded a 50 stake in the development of the field and Frances Total SA along with Malaysias Petronas were awarded a 25 stake The consortium plans production at 535000 barrels per day 85100 m3d ,-1
Marta Botía Alonso,Marta Bota Alonso born 15 September 1974 in Madrid is a Spanish singersongwriter She has a sister named Lidia Their father is a publicist and their mother is an Iberia director She grew up in Lavapis block in Madrid Since she was a child she showed a great interest in music and in the last course of highschool she met Marilia Andrs Casares with whom she created the band Ella baila sola they split up in 2001 ,-1
Gargantua (comics),Gargantua Edward Cobert is a fictional character appearing in American comic books published by Marvel Comics ,-1
Millennium Group,The Millennium Group is a fictional secret society featured in the crime thriller television series Millennium and briefly on The XFiles Having begun life as a Christian sect at the end of the 1st century AD the Group grew into a farreaching network which as the 3rd millennium approached presented itself as a private investigative firm liaising with law enforcement organizations Despite being fraught with internal schisms the Group tried on several occasions to artificially instigate the end of the world as the year 2000 approached The Millennium Groups role as an investigative organization was based on the reallife Academy Group a society of retired law enforcement agents in the United States The presentation of the Group varied as the series progressed with its role changing from that of a benevolent investigative group to an antagonistic mystic sect The Millennium Group has met with negative responses with its vacillating depiction being a focus of criticism both from critics and from series star Lance Henriksen ,-1
Matt Lindstrom,Matthew Raymond Lindstrom born February 11 1980 is an American former professional baseball pitcher He played in Major League Baseball MLB for the Florida Marlins Houston Astros Colorado Rockies Baltimore Orioles Arizona Diamondbacks and Chicago White Sox ,-1
The Real Football Fan Show,The Real Football Fan Show is a British football television talk show that first aired on Channel 4 in 2018 It is presented by Robbie Lyle the founder of AFTV The show features association football fans discussing various topics regarding the Premier League the highest level of the English football league system ,-1
Thomas Duis,Thomas Duis born 1958 in Frankfurt is a German pianist Duis studied with Kurt Gerecke in Wiesbaden KarlHeinz Kmmerling in Hannover and Fanny Waterman in Leeds He was the topranking pianist at the 1986 Artur Rubinstein Competition in Tel Aviv he was awarded the 2nd prize the 1st being declared void and was awarded 2nd prize at the 1986 Gina Bachauer International Piano Competition and 3rd prizes at the 1985 Sydney Competition and the 1987 ARD Competition in Munich Duis had his discographical debut for EMI and has performed internationally since He was the rector of the Hochschule des Saarlandes fr Musik und Theater until 2012 and is a musical ambassador for the GoetheInstitut ,-1
Seed Records,Seed Records has been the name of multiple record labels ,-1
Milžemiai,Milemiai formerly Russian  Polish Milemy is a village in Kdainiai district municipality in Kaunas County in central Lithuania According to the 2011 census the village had a population of 8 people It is located 3 kilometres 19 mi from Laninava surrounded by the Laninavaventybrastis Forest nearby the Suleva river There are gravel quarries ,-1
Townsville District Rugby League,The Townsville District Rugby League TDRL is a rugby league football competition in Townsville Queensland Australia The competition is run under the Queensland Rugby League and features nine clubs who contest a Premiership season across four senior mens and one senior womens grade from April until August ,-1
The Expendables (1988 film),The Expendables released in the Philippines as Full Battle Gear is a 1988 FilipinoAmerican action film directed by Cirio H Santiago and written by Philip Alderton It stars Anthony Finetti Peter Nelson Loren Haynes and Kevin Duffis ,-1
2007 Champions Youth Cup,The 2007 Champions Youth Cup was the first and only staging of the Champions Youth Cup a proposed annual football tournament It was supported by the G14 group and was intended to be a Club World Championship for the Under19 teams of some of the worlds largest clubs It took place in Malaysia from 5 August to 19 August 2007 It featured sixteen teams eleven European teams two teams from South America a host invitee team from Europe a host invitee team from Asia and the U19 national team of the tournament hosts Malaysia Each match lasted only 70 minutes and in the event of a draw in the knockout stage there was no extra time A second edition of the tournament was planned for August 2008 However it was canceled in June two months before the start because of a dispute between the Football Association of Malaysia and the Gifted Group the tournament organizers ,-1
Pareronia tritaea,Pareronia tritaea is a butterfly of the family Pieridae It is found in Indonesia including Sulawesi and the Philippines ,-1
Parabybe,Parabybe subfoveolata is a species of beetle in the family Cerambycidae and the only species in the genus Parabybe It was described by Schwarzer in 1930  References  ,-1
Srđan Ostojić,Sran Ostoji Serbian Cyrillic   born 10 January 1983 is a Serbian former football goalkeeper ,-1
Wheelchair Rugby League World Cup,The Wheelchair Rugby League World Cup is an international wheelchair rugby league tournament contested by the top national teams The tournament was first held in Australia as part of the 2008 Festival of World Cups and was upgrade to a centrepiece event in 2021 ,-1
ShutterBox,ShutterBox is an original Englishlanguage manga written by Rikki Simons and Tavisha WolfgarthSimons The first volume was published by Tokyopop in 2003 The second volume was published in July 2004 The third volume was released in August 2005 and the fourth volume was released in September 2007 As of September 22 2011 five volumes have been released in eBook format and are available to buy on their shop ,-1
Lansdowne Centre,Lansdowne Centre formerly Lansdowne Park Shopping Centre is a shopping mall in Richmond British Columbia Canada It is located on No 3 Road and is the secondlargest mall in Richmond after Richmond Centre The mall has over 56000 square metres 600000 sq ft of retail space and the total site including the parking lot spans over 20 hectares 50 acres ,-1
Our Love Story,Our Love Story Korean  RR Yeonaedam is a 2016 South Korean romantic drama film written and directed by Lee Hyunju starring Lee Sanghee and Ryu Sunyoung ,-1
2019–20 UCF Knights women's basketball team,The 201920 UCF Knights womens basketball team represented the University of Central Florida during the 201920 NCAA Division I basketball season The Knights compete in Division I of the National Collegiate Athletic Association NCAA and the American Athletic Conference The American The Knights in the programs 43rd season of basketball were led by fourthyear head coach Katie AbrahamsonHenderson and play their home games at the CFE Arena on the universitys main campus in Orlando Florida They finished the season 199 115 in AAC play to finish in second place in the regular season In the 2020 American Athletic Conference womens basketball tournament at the Mohegan Sun Arena in Uncasville Connecticut they reached the semifinal where they were ousted by the Cincinnati Bearcats 5751 ,-1
"Astrakhanovka, Azerbaijan",Astrakhanovka is a village in the Jalilabad Rayon of Azerbaijan ,-1
Carl Albert Hintermann,Carl Albert Hintermann 2 November 1876  c 1945 was a Swiss footballer who played for FC Basel He played in the position as defender and as midfielder Between the years 1893 and 1896 Hintermann played a total of 4 games for Basel without scoring a goal These games were friendly games This Swiss domestic league was not founded until 1896 He was also member of the FC Basel board of directors He presided the clubs board during the 191314 season He took over as chairman following Karl Ibach and preceding ErnstAlfred Thalmanns fifth presidential period ,-1
Jałowy Róg,Jaowy Rg jawv ruk is a settlement in the administrative district of Gmina Paska within Augustw County Podlaskie Voivodeship in northeastern Poland close to the border with Belarus It lies approximately 11 kilometres 7 mi east of Paska 30 km 19 mi east of Augustw and 89 km 55 mi north of the regional capital Biaystok  References  ,-1
Gregoire Lake 176,Gregoire Lake 176 is an Indian reserve of the Fort McMurray First Nation in Alberta located within the Regional Municipality of Wood Buffalo It is 35 kilometres southeast of Fort McMurray In the 2016 Canadian Census it recorded a population of 191 living in 62 of its 74 total private dwellings  References  ,-1
Morel's Invention (film),Morels Invention Italian Linvenzione di Morel is a 1974 Italian science fiction film directed by Emidio Greco and starring Anna Karina It is based on the novel The Invention of Morel by Adolfo Bioy Casares ,-1
