title,summary,category
Neutral Bay ferry wharf,Neutral Bay ferry wharf is located on Neutral Bay on the northern side of Sydney Harbour serving the Sydney suburb of Neutral Bay On 20 February 2012 the wharf closed for a rebuild The existing wharf was demolished with a new one built reopening on 20 August 2012 ,0
Mike Hamlin,Mike Hamlin 19352017 was an American labor activist and social workerHamlin was born in Mississippi and moved to Ecorse Michigan just outside of Detroit in 1947Hamlin is featured in the documentary Finally Got The News which documents the formation movement practices and philosophy of the League of Revolutionary Black Workers LRBW a MarxistLeninist organization of Black workers in Detroit that he cofounded ,0
The Dead Girl,The Dead Girl is a 2006 American drama thriller film written and directed by Karen Moncrieff starring Brittany Murphy Toni Collette Rose Byrne and Marcia Gay Harden The film was nominated for several 2007 Independent Spirit Awards including Best Feature and Best Director It is the story of a young womans death and the people linked to her murder It also features Mary Beth Hurt Kerry Washington James Franco Giovanni Ribisi Josh Brolin Mary Steenburgen and Piper Laurie The film was premiered at the AFI Film Festival 7 November 2006 and was given a limited US theatrical release on 29 December 2006 It was generally well received It only ran for two weeks in US firstrun theaters and earned nearly all its revenue from overseas release ,0
List of Important Cultural Properties of Japan (Shōwa period: structures),This list is of Japanese structures dating from the Shwa period 19261989 that have been designated Important Cultural Properties As of October 2016 fiftythree properties with one hundred and eight component structures have been so designated ,0
Charles F. Carpentier,Charles Francis Carpentier September 19 1896  April 3 1964 was an American businessman and politician ,0
James Sutter,James Hutchinson Sutter 1818  13 April 1903 was a 19thcentury member of parliament in Canterbury New Zealand He represented the Gladstone electorate from 1881 to 1887 when he retired He was Mayor of Timaru from 1875 to 1876 and from 1879 to 1882 He died on 13 April 1903 aged 85  References  ,0
A Lost Lady (1934 film),A Lost Lady is a 1934 American drama film directed by Alfred E Green and starring by Barbara Stanwyck Frank Morgan and Ricardo Cortez Based on the 1923 novel A Lost Lady by Willa Cather with a screenplay by Gene Markey and Kathryn Scola the film is about a woman whose fianc is murdered by his mistress husband two days before their wedding Her uncle sends her away to the mountains where she meets a man who looks after her and eventually proposes She accepts even though she does not love him Warner Brothers had filmed this story before in 1924 as a silent with Irene Rich ,0
"Frederick Ferdinand, Duke of Anhalt-Köthen",Frederick Ferdinand of AnhaltKthen 25 June 1769 in Pless  23 August 1830 in Kthen was a German prince Ascanian ruler of the principality of AnhaltPless and from 1818 of the duchy of AnhaltKthen He was the second son of Frederick Erdmann Prince of AnhaltPless and his wife Countess Louise Ferdinande of StolbergWernigerode daughter of Henry Ernest Count of StolbergWernigerode ,0
Walter Bénéteau,Walter Bnteau 28 July 1972  10 December 2022 was a French professional cyclist He raced in every Tour de France from 2000 until 2006 ,0
Alexander Mayer (swimmer),Alexander Mayer born 7 July 1967 is a German former swimmer He competed in two events at the 1988 Summer Olympics representing West Germany ,0
Picauville,Picauville French pronunciation pikovil is a commune in the Manche department in Normandy in northwestern France On 1 January 2016 the former communes of Amfreville Cretteville Gourbesville Houtteville and Vindefontaine were merged into Picauville On 1 January 2017 the former commune of Les MoitiersenBauptois was merged into Picauville The inhabitants are called Picauvillais Picauville also has a 17th century castle classified as a historical landmark by the French government called the IsleMarie Castle Parts of the structure date to the 11th century ,0
Aulopoma grande,Aulopoma grande is a species of small land snail with an operculum terrestrial pulmonate gastropod mollusc in the family Cyclophoridae It is endemic to Sri LankaIt is about 2127mm in length  References  ,1
Bonito River (Canoinhas River tributary),The Bonito River is a river of Santa Catarina state in southeastern Brazil It is part of the Paran River basin and is a tributary of the Canoinhas River ,-1
Ford ministry,The Ford ministry is the Cabinet chaired by Premier Doug Ford that began governing Ontario shortly before the opening of the 42nd Parliament The original members were sworn in during a ceremony held at Queens Park on June 29 2018Ford has carried out four major Cabinet reshuffles once in 2019 2021 2022 and 2023 ,-1
Jonathan Dixon (actor),Jonathan Dixon born 10 August 1988 known professionally as Jonny Dixon is a British television actor best known for playing playground bully Matthew Mooey Humphries in longrunning CBBC show Grange Hill He appeared in Manchesterbased soap opera Coronation Street as Darryl Morton He joined the soap in March 2007 Dixon was born in Pudsey He was a friend of Jack P Shepherd who plays his onscreen friend David Platt before getting his role in Coronation Street It was reported on 15 May 2009 that Dixon and costar Wanda Opalinska would be written out of the soap and would be departing later in the year with it being said that this was due to natural storyline progression He last appeared in the episode broadcast on 16 October 2009 In April 2011 Dixon filmed an episode of Doctors to be broadcast on BBC1 in July 2011 He was a regular on Boy Meets Girl playing the role of James on the first two series airing 201516 For the last three years he has taken part in Show in a Week at South Craven School  a musical theatre production which is conceived choreographed and rehearsed in just three days In 2018 Dixon appeared in the Doctor Who episode The Woman Who Fell to Earth as Karl a crane driver being hunted by an alien species He reprised the role in Eve of the Daleks the 2022 New Year specialDixon runs his own independent film production company Isaac Who which is based in Leeds in the North of England The company creates film TV and video productions with specialism in actor showreels corporate videos and live music video recordings Dixon also produces and directors original films as part of Isaac Who In 2019 he directed a series of short films in collaboration with Psychotastic Productions These included Assisted featuring his former Coronation Street costars Steven Arnold and Steve Huison and The Invisible Collection starring Ian Gelder  Mark Wingett ,-1
Tulian lake,Tulian Lake is an alpine lake located near Pahalgam in Anantnag district of Jammu and Kashmir India It lies at an altitude of 3684 metres 12087 ft above sea level 16 kilometres 99 mi southwest from Pahalgam and 11 kilometres 68 mi from Baisaran The lake often has chunks of ice floating in it It is surrounded on three sides by mountains that rise to over 4800 metres 15700 ft and that are usually covered with snow It is located in a meadow dotted with pine forests The lake lies in the great Himalayan range  References  ,-1
Simply Equal,Simply Equal is a grassroots coalition that formed to petition the city of Lawrence Kansas to add the words sexual orientation to its Human Relations Ordinance In May 1995 Lawrence passed the Simply Equal Amendment thus becoming the first city in Kansas to prohibit discrimination in housing employment and public accommodations on the basis of sexual orientation Simply Equal was formed in 1991 and was led by the newly organized Freedom Coalition Active supporters were the Lawrence National Organization for Women chapter the American Civil Liberties Union the League of Women Voters the Kansas University Ecumenical Christian Ministries and the Kansas University LesBiGay Services group Lynne Green and Ben Zimmerman were cochairs of Simply Equal Sidenote Lawrence Kansas actually became the second municipality in the state to adopt such legislation Wichita Kansas was the first in the 1970s The Wichita antidiscrimination legislation was repealed in a referendum vote shortly after its installation ,-1
Sean Russell (rugby league),Sean Russell born 27 May 2002 is an Australian professional rugby league footballer who plays as a winger or centre fullback for the Parramatta Eels in the National Rugby League NRL ,-1
List of Swedish men's handball champions,The Swedish mens handball champions Swedish Svenska mstare i handboll fr herrar have been determined by three different competitions From 193132 until 195152 the title was decided by a straight knockout tournament known as Svenska msterskapet the Swedish Championship After 193435 it was played parallel to the highest league Allsvenskan The tournament was contested by the winners of the Distriktsmsterskap Provincial Championships until 194546 After that it was contested by all teams from the top division all Provincial Champions and invited teams from lower leagues From 195253 until 196667 the title of Swedish Champions was awarded to the winners of Allsvenskan Since 196768 the Swedish Champions have been determined by a playoffs competition between the highestplaced teams in the top league Until 200304 all playoff rounds were decided by a series of home and away matches Between 200405 and 201718 the final was played as a single match at a predetermined venue Since 201819 the final is again played as a series The league changed its name to Elitserien in 199091 and to Handbollsligan in 201617 Redbergslid have won the most Swedish Championships with 20 followed by Drott at 11 These two clubs completely dominated Swedish mens handball from 198384 to 200203 winning all titles but one They are followed by Kristianstad at 9 titles and four clubs at 7 titles Heim Hellas Majorna and Svehof Majorna have won the title the most times in a row winning it five times from 1942 to 1946 Vsters IK and AIK are the only teams to have won the championship in its pre1952 knockout format while playing outside the top flight Drott have been runnersup 12 times more than any other team Teams from the Gothenburg area Redbergslid Heim Majorna and Svehof have won 41 of 91 titles Since 1978 clubs from southern and western Gtaland have won 42 of 45 titles the other three being won by Stockholm club Hammarby The current champions are IFK Kristianstad ,-1
Krisko,Kristian Radoslavov Talev Bulgarian    born 11 May 1988 better known by his stage name Krisko Bulgarian  is a Bulgarian recording artist songwriter producer and entrepreneur He is signed to the Bulgarian record label Facing The Sun Records and is also coowner of the label Adamand Records ,-1
Medina Warda Aulia,Medina Warda Aulia born 7 July 1997 in Jakarta is an Indonesian chess player She has held the title of International Master since 2020 and Woman Grandmaster since 2013She qualified for the Womens Chess World Cup 2021 being defeated by Harika Dronavalli in the second round and the Womens Chess World Cup 2023 where she beat Janelle Mae Frayna in the first round and Sarasadat Khademalsharieh in the second round ,0
Gayratjon Hasanov,Gayratjon Hasanov born 12 January 1983 in Qarshi Uzbek SSR Soviet Union is Uzbek footballer who plays as a goalkeeper for Nasaf Qarshi He is a member of Uzbekistan national football team ,0
Michael Carr (composer),Michael Carr born Maurice Alfred Cohen 11 March 1905  16 September 1968 was a British and Irish popular music composer and lyricist best remembered for the song South of the Border Down Mexico Way written with Irishman Jimmy Kennedy for the 1939 film of the same name ,0
Mark E. Robinson,Mark E Robinson is an American attorney and former Massachusetts government official who served as Secretary of Administration and Finance of Massachusetts from 1992 to 1994 ,0
Oneonta Formation,The Oneonta Formation is a geologic formation in New York It preserves fossils dating back to the Devonian period It consists of shale sandstone and conglomerate and is part of the Genesee Group ,0
Avrohom Genachowsky,Avrohom Genachowsky also spelled Avraham Genechovsky or Genichovsky September 1936  October 11 2012 was an Orthodox Jewish rabbi and talmudic scholar He served as dean rosh yeshiva at Yeshivas Tchebin in Jerusalem ,0
Nadège,Nadge is a French feminine given name ,0
Facundo Moyano,Juan Facundo Moyano born 25 December 1984 is an Argentine trade unionist and politician A member of the Party of Culture Education and Labour CET Moyano was a National Deputy for Buenos Aires Province from 2011 to 2021 From 2009 to 2017 Moyano was Secretary General of the Sindicato nico de Trabajadores de los Peajes y Afines SUTPA the toll booth workers union Moyano is the son of Hugo Moyano one of Argentinas most prominent union leaders and former Secretary General of the General Confederation of Labour ,0
W. H. Clark (brewer),William Henry Clark c18151870 was an early settler and brewer in Adelaide in the Colony of South Australia He was the founder of the Halifax Street Brewery around 1844 sold in 1856 and in 1859 was responsible for the building of a brewery at the western end of Hindley Street However he fell into insolvency leaving the state in 1860 to avoid his debtors and the Hindley Street brewery taken over by William Knox Simms later becoming the West End Brewery ,0
Asai (surname),Asai is a Japanese surname which means shallow well Notable people with the surname include Akihiro Asai   born 1975 Japanese race car driver Asai Ch   18561907 Japanese painter Eriko Asai   born 1959 Japanese longdistance runner Hiroshi Asai   born 1978 Japanese arranger musician and composer Isao Asai   born 1942 Japanese ice hockey player Itsuki Asai   born 1971 Japanese baseball player Katsuaki Asai born 1942 highranking teacher of Aikido in Germany Kiyomi Asai   born 1974 Japanese voice actress Makate Asai   born 1959 Japanese writer Asai Ryi   c 16121691 Japanese writer Tetsuhiko Asai   19352006 Shotokan karate master Yasuhiro Asai   born 1983 Japanese lacquer artisan Yoshihiro Asai   born 1966 Japanese professional masked wrestler wrestling under the name Ultimo Dragon Yoshiko Asai   born 1941 Japanese voice actress ,0
Daniel Daperis,Daniel Daperis Greek   is an Australian actor and director He is best known for his acting roles in the television series The Man From Snowy River and the childrens television series Thunderstone Daniel Daperis is the older brother of actor Jared Daperis ,0
Alf Tergel,Alf Henry Tergel 8 August 1935  15 October 2007 was a Swedish church historian ,0
Gordan Golik,Gordan Golik born 4 March 1985 in Varadin is a Croatian professional footballer who plays as a midfielder for Mejimurec ,0
Leixlip Spa,The Leixlip Spa Irish Sp Lim an Bhradin also known as Louisa Bridge Spa is an archaeological and hydrogeological complex at Louisa Bridge Leixlip Ireland situated close to the Royal Canal Ireland It was a popular health spa in the late 18th and early 19th century The site is known to contain a warm mineralised spring and a cold spring originating from different sources The archaeological structures comprise a hexagonal spring well and a Romanesque bath The warm spring was uncovered in 1794 during the construction of the Royal Canal The mineral spring marsh and seepage areas at Louisa Bridge are included in the Rye Water ValleyCarton Special Area of Conservation ,0
Miscibility gap,A miscibility gap is a region in a phase diagram for a mixture of components where the mixture exists as two or more phases  any region of composition of mixtures where the constituents are not completely miscible The IUPAC Gold Book defines miscibility gap as Area within the coexistence curve of an isobaric phase diagram temperature vs composition or an isothermal phase diagram pressure vs compositionA miscibility gap between isostructural phases may be described as the solvus a term also used to describe the boundary on a phase diagram between a miscibility gap and other phasesThermodynamically miscibility gaps indicate a maximum eg of Gibbs energy in the composition range ,1
Cataby Important Bird Area,Cataby Important Bird Area is a 314 ha tract of land lying about 2 km south of the town of Cataby adjacent to the Brand Highway in the Wheatbelt region of Western Australia It has been classified by BirdLife International as an Important Bird Area IBA because it supports up to 24 breeding pairs of shortbilled black cockatoo an endangered species that nests in remnant patches of eucalypt woodland and isolated paddock trees and feeds in native shrublands The area also supports the restrictedrange western corella and a globally significant population of the regent parrot  References  ,-1
2020 Niue National Awards,The 2020 Niue National Awards were the first awards made under the Niue National Awards system to recognise achievement and service by Niueans They were announced in October 2022The recipients of honours are displayed here as they were styled before their new honour ,-1
Hüseyin Aygün,Hseyin Aygn born 20 October 1970 Tunceli is a Turkish lawyer and politician of Alevi Zaza origin He is a former Member of the Grand National Assembly of Turkey for the Republican Peoples Party CHP and a founder of the Tunceli Bar Association ,-1
Ray Branighan,Ray Branighan born 5 December 1947 is an Australian former professional rugby league footballer a star wing and Centre of the 1970s for the South Sydney Rabbitohs the ManlyWarringah Sea Eagles as well as the New South Wales state and Australian national representative sides ,-1
Lake Whirirau,Lake Whirirau is a lake in the Northland Region of New Zealand ,-1
Fax (surname),Fax is a surname Notable people with the surname include Elton Fax 19091993 American illustrator cartoonist and author Jesslyn Fax 18931975 American actress Mark Fax 19111974 American composer Matt Fax born 1996 French electronic musician and record producer ,-1
2007 European Athletics U23 Championships – Women's 100 metres hurdles,The womens 100 metres hurdles event at the 2007 European Athletics U23 Championships was held in Debrecen Hungary at Gyulai Istvn Atltikai Stadion on 13 and 14 July ,-1
Geoffrey Chang,Geoffrey Chang is a professor at the University of California San Diegos Skaggs School of Pharmacy and Pharmaceutical Sciences and Department of Pharmacology School of Medicine His laboratory focuses on the structural biology of integral membrane proteins particularly exploring Xray crystallography techniques for solving the tertiary structures of membrane proteins that are notoriously resistant to crystallization The laboratory has specialized in structures of multidrug resistance transporter proteins in bacteria In 2001 while a faculty member of The Scripps Research Institute Chang was awarded a Beckman Young Investigators Award designed to support researchers early in their academic careers for his work on the structural biology of multidrug resistance Chang announced a move from Scripps to neighboring UC San Diego in 2012In 2007 Chang and coauthors retracted five previously published papers describing the structures of three multidrug transporter proteins after another research group published a widely differing structure which led to the discovery of a critical bug in the Chang groups custom software tools Since that time however Chang has published other papers in the field of structural biology and has been awarded a EUREKA grant for exceptionally innovative research projects that could have an extraordinarily significant impact on many areas of science from the National Institutes of Health ,-1
United Nations Public Service Awards,The United Nations UN Public Service Award is the most prestigious international recognition of excellence in public service It rewards the creative achievements and contributions of public service institutions that lead to a more effective and responsive public administration in countries worldwide Through an annual competition the UN Public Service Awards promotes the role professionalism and visibility of public service ,0
Aemene amnaea,Aemene amnaea is a moth of the family Erebidae It was described by Charles Swinhoe in 1894 It is found in Assam India  References  ,0
Netta Rheinberg,Netta Rheinberg MBE 24 October 1911  18 June 2006 was an English cricketer journalist and administrator She appeared in one Test match for England in 1949 against Australia She played domestic cricket for MiddlesexHer single Test match came on Englands tour of Australia in 194849 She was the teams manager and had to play in the match because of injuries to other players She made a pair becoming the first woman to do so on Test debutRheinberg was most notable in the womens game as an administrator and journalist Rachael HeyhoeFlint the former England captain said of her work as an administrator Netta was an action girl We had very few people then and she galvanised activity partly just by having a great personality and a sense of humour For a north London Jew playing cricket for England and being one of the games most important administrators is about as welltrodden a career path as prime minister or baconbuttie salesman wrote Rob Steen shortly after her death aged 94 in 2006 That Rheinberg happened to be a woman made her accomplishments all the more admirableShe was secretary of the Womens Cricket Association in 1945 and from 1948 to 1958 She was also membership secretary and vicechairman of the Cricket Society She edited the magazine Womens Cricket reported on womens cricket for Wisden for more than thirty years and wrote a regular column for The Cricketer With HeyhoeFlint as coauthor Rheinberg wrote a history of the womens gameIn 1999 she was one of the first ten women to be awarded honorary membership of MCC ,0
Anne Oldeland,Anne Oldeland died 21 February 1602 was a Danish noble and landowner She is known for the feud she had with the local representatives of the Danish church on Funen in 15611567 She was born to Hans Oldeland and Sophie Munk and married the noble landowner Hans Norby til Uggerslevgrd d 1565 From 1561 the couple was involved in a famous conflict with the Danish church through its local representative three parish vicars in succession of the Ugglerslev parish They actively tried to stop the sermons by having the church doors locked to the vicar The legal process was represented by her spouse but she was the dominant party in the conflict In 1567 she was forced to submit to the church ,0
Payette City Hall and Courthouse,The Payette City Hall and Courthouse at 3rd Ave and 8th St in Payette Idaho was built in 1912 It was listed on the National Register of Historic Places in 1979It is a twostory brick building upon a raised foundation built in Classical Revival style It is three bays wide with bays separated by terra cotta pilasters and four bays deep Its entry bay rises to a pedimented cornice The builder was J Ronald WalkerIt was deemed architecturally significant as a good local example of the NeoClassical Revival style in Payette Although of modest scale and ornament it nevertheless is one of the towns more outstanding structures and the major one in the downtown area to display Classical details and proportions Situated at the end of Third Avenue Payettes main street it dominates the streetscape in the north end and for many years served as a symbol of civic authority Further contributing to the buildings significance is its having functioned for a number of years as a seat of local government Not only did it house the city government but after the formation of Payette County in 1917 it also contained the county governmentThe city offices moved out in the 1950s and the county offices moved out in the 1970s  References  ,0
Bronson (album),Bronson stylised in all caps is the eponymous debut studio album by Bronson the collaborative project of American DJs Odesza and Australian producer Golden Features It was released on 7 August 2020 delayed from an initial 17 July release The album debuted and peaked at number 22 on the ARIA Albums Chart in Australia on 17 August 2020 and at number 5 on the US Top DanceElectronic Albums Chart on 22 August 2020 ,0
Gazo (rapper),Ibrahima Diakit French pronunciation ibaima djakite born August 5 1994 better known by his stage name Gazo pronounced azo is a French rapper of Guinean descentGazo is from a suburb of Paris called SaintDenis It is often named in many of his songs and also often identified as the 93 based on the French INSEE code for the region In his youth he got involved with a lot of troublemaking His parents kicked him out by age 12 and by age 15 he left school deciding to embark on his rap career along with some of his friends in SaintDenis eventually leading him to join the Gangster Disciple Nation GDN around the age of 16 with his friends Putting a number of songs on YouTube he got the attention of Gims who offered a joint track to him on his own album Le Flau Gazo released his own mixtape Drill FR on 26 February 2021 It reached number 1 on the French Albums Chart with the single HaineSex reaching number 2 on the French Single Chart Gazo has had much success in his rap career since HaineSex has since received diamond certification He is commonly known as The Prince of French Drill Per one of his producers Flem KGB as well as a general consensus among fans of French rap Gazo created an identifiable brand for French drill music taking influence from UK and US drill yet unique on its own ,0
Tierce (unit),The tierce also terse is both an archaic volume unit of measure of goods and the name of the cask of that size The most common definitions are either onethird of a pipe or fortytwo gallons In the petroleum industry  a barrel of oil is defined as 42 US gallons ,0
